Titel,URL,Beschreibung,Sentiment,Top-Level-Domain
"Jahresbericht ""Fakten und Zahlen zur maritimen Abhängigkeit der ...",https://www.bundeswehr.de/resource/blob/156014/fa1039c05301b9c63ad642c683880778/jahresbericht-marinekommando-2019-data.pdf,"Mar 20, 2019 ... ... Arktis. Jahresbericht Deutsche Marine 13. Weltweit sicherer Seehandel ... Alternative Schiffsantriebe. Methanol, Hybridantrieb, LNG oder ...",neutral,de
Die „Neue Seidenstraße“ – Zwischen Mythos und Geopolitik,https://www.budrich-journals.de/index.php/gwp/article/viewFile/31459/27058,"ßung neuer maritimer Handelsrouten. Abgekürzt als OBOR, dem englischen ... Arktis-Strategie.24 In Abstimmung mit Rußland soll eine „Silk Road on Ice ...",negativ,de
R Graphics Output,https://www.ids-mannheim.de/fileadmin/lexik/bilder/all.links.pdf,... Alternative alternativlos alternierend. Altersasyl. Altersgeschmack. Altersheim ... Arktis arktisch. Arktogäa armdick. Armgelenk. Aromaaufguss arschling.,neutral,de
Anno 1800 - Produktionsketten - Neue Welt - Annoinfo.de,https://www.annoinfo.de/Anno_1800/produktionsketten-2.html,"Feb 13, 2022 ... Effiziente Handelsrouten stellen sicher, dass diese Waren ohne Verzögerung transportiert werden. ... Übersicht. Alte Welt. Neue Welt. Arktis.",positiv,de
Chinas Aufstieg zur Globalmacht,https://www.bmlv.gv.at/pdf_pool/publikationen/01_2020_s_iss_hauser_china_1949_2019_kern_ae_final1105webv.pdf,"8. 352 Rückenwind für Alternative, in: Die Presse, 15.02.2016, S. 6. 353 ... relevante Handelsrouten verlaufen. Chinas Außenministerium verteidigte.",negativ,gv.at
"Sustainable Blue Economy – Transformation, Wert und Potential der ...",https://www.feri-institut.de/media/5uheg23o/fcfi_blue-economy.pdf,"Jul 19, 2022 ... Alternative sein – insbesondere im Hinblick auf die Ernäh- ... rinen Arktis, um neue, an die Kälte angepasste Enzyme für ...",negativ,de
"Trumps Grönland-Vorstoß: „Die USA hätten einen Vorposten, über ...",https://www.welt.de/politik/ausland/article255088358/Trumps-Groenland-Vorstoss-Die-USA-haetten-einen-Vorposten-ueber-den-sie-die-Arktis-besser-kontrollieren-koennen.html,"Jan 10, 2025 ... „Die USA hätten einen Vorposten, über den sie die Arktis besser kontrollieren können“ ... Co-leader of the far-right Alternative for Germany (AfD) ...",negativ,de
Bundesbericht Forschung und Innovation 2020 - Forschungs- und ...,https://www.bmbf.de/SharedDocs/Publikationen/de/bmbf/1/31611_1_BUFI_2020_Hauptband.pdf?__blob=publicationFile&amp;v=7,... Alternative zur akademischen Bildung gestärkt wird. Die Bundesregierung hat ... Arktis-Expedition aller Zeiten statt. Der Forschungseisbrecher ...,negativ,de
Ozeane und Meere,https://www.buergerundstaat.de/4_19/ozean_meere.pdf,"Arktis. Doch heißt das nicht, dass die gegenwärtigen mee- respolitischen ... onalen Handelsrouten. Die Abhängigkeit vom Handel, ins- besondere bei ...",negativ,de
"Arild MOE | Fridtjof Nansen Institute, Lysaker | Research profile",https://www.researchgate.net/profile/Arild-Moe,"In the autumn of 2015, 5500 migrants traveling through Russia along the “Arctic route” applied for political asylum in Norway. ... alternative areas of future oil ...",neutral,net
Zukunftsfähiges Wirtschaften: Herausforderungen der ...,https://www.ssoar.info/ssoar/bitstream/handle/document/89375/ssoar-2023-novy_et_al-Zukunftsfahiges_Wirtschaften_Herausforderungen_der_sozialokologischen.pdf?sequence=1&isAllowed=y&lnkname=ssoar-2023-novy_et_al-Zukunftsfahiges_Wirtschaften_Herausforderungen_der_sozialokologischen.pdf,"Arktis, welcher organische Substanzen enthält. Das Auftauen ermöglicht die ... sierung keine Alternative. Tatsächlich erstarkten mit Rechtspopulismus ...",negativ,info
Drake-Passage und Kap Hoorn - Antarktis | Antarktis.net,https://www.antarktis.net/landeskunde-reiseinfo/die-drake-passage-und-kap-hoorn.html,"Erzählungen, das Kap mitsamt des dort gelegenen Seewegs zwischen Atlantik und Pazifik seien bereits 1578 von Francis Drake entdeckt worden, scheinen eine ...",neutral,net
„Absolute Notwendigkeit“: Trump will Kontrolle der USA über ...,https://www.diepresse.com/19201515/absolute-notwendigkeit-trump-will-kontrolle-der-usa-ueber-groenland,"Dec 23, 2024 ... Durch seine Lage in der Arktis, die Nähe zu Russland, wegen ... Handelsrouten der Welt. Anfang des 20. Jahrhunderts führten die USA ...",negativ,com
Anno 1800 Guide: 8 Tipps für aufstrebende Baumeister,https://www.redbull.com/ch-de/anno-1800-tipps-guide,"Apr 16, 2019 ... Läuft eure zweite Insel, müsst ihr diese über Handelsrouten noch mit eurem Hauptwohnsitz verbinden. ... Cloud Gaming: Eine echte Alternative zum ...",neutral,com
Zielmarktanalyse Japan – MARITIME WIRTSCHAFT,https://japan.ahk.de/filehub/deliverFile/91d7ae57-7261-452c-8324-cff2e8370e45/1005135/ZMA_GA_Japan_Maritime%20Wirtschaft_1005135.pdf,"Oct 15, 2020 ... der Neuausrichtung von Handelsrouten und der Ausstattung der Häfen mit der Versorgungsinfrastruktur für Schiffe mit neuen. Antriebssystemen ...",neutral,de
Member Detail - Centre Marc Bloch,https://cmb.hu-berlin.de/en/team/profil/sophie-lambroschini,"Sophie Lambroschini is an expert of contemporary Russia and Ukraine with an eye on elite networks, ordinary economic actors, and economic sociology of conflict.",negativ,de
"Rohstoffe, Schifffahrtswege und Raketen: Trump will viel mehr als ...",https://www.bluewin.ch/de/news/international/trump-will-viel-mehr-als-groenland-putin-und-xi-ebenfalls-2627147.html,"Mar 28, 2025 ... Rohstoffe und Handelsrouten erhöhen die geostrategische Bedeutung der Arktis, weshalb die Anrainer dort auch aufrüsten. ... Damit wird das ...",negativ,ch
Trumps radikale Außenpolitik: Annexionspläne sorgen für Unruhe in ...,https://www.marktundmittelstand.de/politik/trumps-annexionsplaene-wirtschaftliche-schockwellen-einer-neuen-weltordnung,"Jan 10, 2025 ... Wirtschaftliche Implikationen für den globalen Handel. Trumps Ankündigungen haben weitreichende Folgen für die globale Wirtschaftsordnung.",negativ,de
Historischer Kontext - FasterCapital,https://fastercapital.com/de/thema/historischer-kontext.html,"Der Niedergang der Seidenstraße begann mit dem Untergang des Mongolenreiches und wurde durch die Erkundung des Meeres, die alternative Handelsrouten bot, noch ...",negativ,com
Schifffahrt: Wie schützt Deutschland seine Handelswege?,https://www.wiwo.de/unternehmen/handel/seehandel-die-freiheit-der-meere-ist-bedroht-und-damit-deutschlands-wohlstand/29717794.html,"Mar 21, 2024 ... Immer mehr Kriege und Konflikte gefährden die Handelsrouten. Was dies für Lieferketten und Unternehmen bedeutet ... Arktis weiter schmilzt.",negativ,de
Northern Sea - Deutsch-Übersetzung – Linguee Wörterbuch,https://www.linguee.de/englisch-deutsch/uebersetzung/northern+sea.html,... Alternative Übersetzungen anzeigen · north adj —. nördlich ... opening of a northern seaway from Europe across the Arctic to Asia - the Northern Sea Route.,neutral,de
Flusskreuzfahrt auf der Donau vom Schwarzen Meer nach Wien mit ...,https://www.kreuzfahrtzentrum.at/flusskreuzfahrten/reiseziele/schwarzes-meer-nach-wien-2025/,Aber auch Geheimtipps wie Arbanassi oder die Felsenkirchen von Iwanowo zeugen vom reichen kulturellen Erbe entlang der alten Handelsrouten des Habsburgerreiches ...,negativ,at
