Titel,URL,Beschreibung,Sentiment,Top-Level-Domain
Arktische Seewege - Stiftung Wissenschaft und Politik,https://www.swp-berlin.org/10.18449/2020S14/,"Weil das Meereis schmilzt, eröffnet sich für die Zukunft zugleich eine kürzere Route für den globalen Handel zwischen Asien und Europa, mit der sich Zeit und ...",negativ,org
Die Arktis im Fokus Russlands | Der Pragmaticus,https://www.derpragmaticus.com/r/russland-arktis,"Feb 26, 2024 ... Moskau versucht auch, die Kontrolle über den Nördlichen Seeweg zu erlangen, eine lukrative Handelsroute zwischen Asien und Europa. Aufholjagd.",negativ,com
Neues Schiff für Putins Flotte: Atomeisbrecher mit „strategischen ...,https://www.fr.de/politik/russland-arktis-wirtschaft-handelsroute-neues-schiff-putins-flotte-atomeisbrecher-strategische-ziele-91934715.html,"Nov 23, 2022 ... ... alternative Handelsrouten für sein politisch nahezu isoliertes Land sichern. ... Arktis ausgelegt und laut russischen Angaben in der Lage ...",neutral,de
Russland hofft auf Nordostpassage als Alternative zum Suezkanal ...,https://www.businessinsider.de/wirtschaft/russlands-traum-macht-klimawandel-nordostpassage-durch-arktis-und-nordsee-zur-alternative-zum-suezkanal/,"Feb 2, 2024 ... Russland wirbt schon lange dafür, im Handel zwischen Asien und Europa die Nordroute durch die Arktis zur Alternative zur Südroute durch den ...",negativ,de
Schon die Wikinger betrieben Transatlantik-Handel - Handelsrouten ...,https://www.scinexx.de/news/archaeologie/schon-die-wikinger-betrieben-transatlantik-handel/,"Oct 7, 2024 ... Denn die Jagd auf Walrosse und deren Elfenbein-Stoßzähne führte die Wikinger-Jäger bis an die Grenze Grönlands zur nordamerikanischen Arktis.",negativ,de
"Wenn das arktische Eis schmilzt, könnte sich die Weltordnung ...",https://www.nordschleswiger.dk/de/daenemark-politik/wenn-arktische-eis-schmilzt-koennte-sich-weltordnung-aendern,"Jan 27, 2025 ... Mit dem Abschmelzen der Arktis werden die drei Handelsrouten aus ... Daher können die arktischen Routen als Alternative zu den Kanälen ...",negativ,dk
"Neue Handelsrouten am Nordpol: ""In der Arktis sind praktisch alle ...",https://www.n-tv.de/wirtschaft/In-der-Arktis-sind-praktisch-alle-Grenzkonflikte-geklaert-article25625087.html,"Mar 15, 2025 ... Die Nordostpassage könnte langfristig theoretisch eine Alternative zur derzeit gängigen südlichen Schifffahrtsstrecke werden. Sie führt von ...",negativ,de
China und Russland treiben eisige Arktis-Handelsroute voran,https://finanzmarktwelt.de/china-und-russland-treiben-eisige-arktis-handelsroute-voran-322471/,"Was einst als saisonal und nur schwer passierbar galt, scheint nun zu einer ernsthaften Alternative zur herkömmlichen Route zu werden. Die NSR entlang der ...",negativ,de
Im Nordpolarmeer passiert etwas Einzigartiges – und Deutschland ...,https://www.focus.de/earth/klimapolitik/im-nordpolarmeer-passiert-etwas-einzigartiges-und-deutschland-ist-davon-betroffen_c27388d3-3295-4f50-8b68-2b3473daec7d.html,"Jan 23, 2025 ... Weil das Eis in der Arktis durch den Klimawandel schmilzt, entstehen dort drei neue Handelsrouten für Schiffe ... Alternate · Christ · Expedia ...",neutral,de
Ist die Polare Seidenstraße eine Alternative zum Suezkanal? | trans ...,https://trans.info/de/ein-weiterer-reeder-verzichtet-auf-alternative-route-zum-suezkanal-und-appelliert-an-andere-betreiber-394236,"Aug 26, 2024 ... Aufgrund der Krise am Roten Meer sind Reeder gezwungen, nach alternativen Handelsrouten zum Suezkanal zu suchen.",negativ,info
Risiko aus der Arktis: Polare Seidenstraße und Russlands ...,https://www.freiheit.org/de/global-security-hub-bruessel/polare-seidenstrasse-und-russlands-nordmeerflotte,"Apr 26, 2023 ... ... Handelsrouten verändern das geopolitische Gleichgewicht. Ein ... Die liberale Weltordnung steht unter Druck: Während die BRICS-Staaten alternative ...",negativ,org
Transportwege für den Handel zwischen Asien und Europa: Für die ...,https://dievolkswirtschaft.ch/de/2012/09/lampe/,"Sep 1, 2012 ... ... alternative Routen bzw. Einsatzformen von Verkehrsträgern in ... − Schönstein, Jürgen (2000): Eisfreie Arktis verkürzt auch den Seeweg nach Asien.",negativ,ch
Auswirkungen der Klimaveränderung auf die Routen im ...,https://sgkv.de/wp-content/uploads/2020/04/Bachelorarbeit_Nicolas_Schulte.pdf,"Um trotz der Zollpolitik der Arktis-Anrainerstaaten profitabel Handel führen zu können, ... potential economic viability of using the Northern Sea Route (NSR) as ...",negativ,de
Russland eröffnet 2024 Arktisroute für den Transport von Ural-Rohöl ...,http://de.marinelink.com/news/russland-er%C3%B6ffnet-2024-arktisroute-f%C3%BCr-den-von-nach-299107,"Jul 30, 2024 ... Russland eröffnet 2024 Arktisroute für den Transport von Ural-Rohöl ... Russland möchte von seinen westlichen Häfen aus alternative Routen ...",neutral,com
Machtkampf um die polare Seidenstraße – KATAPULT-Magazin,https://katapult-magazin.de/de/artikel/machtkampf-um-die-polare-seidenstrasse,"Jun 16, 2021 ... Durch die Arktis fuhren in den letzten fünf Jahren gerade einmal 150 Schiffe. Der Unterschied ist also groß. Für Fahrten zwischen Asien und ...",negativ,de
Klimawandel: Nordwestpassage ist keine Alternative zum ...,https://www.faz.net/pro/weltwirtschaft/klima-ressourcen/klimawandel-nordwestpassage-ist-keine-alternative-zum-panamakanal-110133501.html,"Nov 27, 2024 ... Trotz der Erderwärmung eignet sich die kurze Nordwestpassage durch die Arktis nicht als Alternative zum Suezkanal oder zum Panamakanal.",negativ,net
Schifffahrt: Zum Suezkanal gibt es keine realistische Alternative ...,https://www.zeit.de/politik/ausland/2021-04/schifffahrt-arktis-nordostpassage-seeweg-china-russland-welthandel-eisschmelze-5vor8,"Apr 13, 2021 ... Neben zwölf anderen Ländern hat es sich 2013 in dem 1996 gegründeten Arktis ... Nahezu alle Handelsrouten zur See sind von US-Amerikanischen ...",neutral,de
Wie erfolgreich ist Chinas Neue Seidenstraße?,https://www.deutschlandfunk.de/neue-seidenstrasse-verblasst-mythos-100.html,"Sep 14, 2023 ... Inzwischen geht China das Geld aus – und der Westen versucht, alternative Handelsrouten zu erschließen. ... Arktis. Es folgten ...",positiv,de
Der schmelzende Schild - Auslandsinformationen - Konrad ...,https://www.kas.de/de/web/auslandsinformationen/artikel/detail/-/content/der-schmelzende-schild,"Apr 18, 2023 ... Der Handel über die Arktis ... Für die Volksrepublik China bietet sich mit dem Nördlichen Seeweg eine alternative Route zum klassischen Seeweg.",negativ,de
Nördlicher Seeweg: Klimawandel schafft neue Handelswege,https://www.tagesspiegel.de/wirtschaft/klimawandel-schafft-neue-handelswege-4606654.html,"Oct 26, 2018 ... Weil die Arktis schmilzt, können Schifffahrtsunternehmen neue Routen ... An eine Alternative zu den derzeitigen Routen werde derzeit noch nicht ...",negativ,de
Die Schifffahrt am Scheideweg « World Ocean Review,https://worldoceanreview.com/de/wor-7/transporte-ueber-das-meer/die-schifffahrt-am-scheideweg/,"Zudem ist absehbar, dass mögliche alternative Kraftstoffe zunächst einmal teurer sein werden als Treibstoffe auf Erdölbasis. ... In der Arktis taut im Zuge ...",negativ,com
Arktis - Freie Fahrt durchs Eismeer - Wissen - SZ.de,https://www.sueddeutsche.de/wissen/arktis-freie-fahrt-durchs-eismeer-1.3577825,"Jul 10, 2017 ... Weil das Eis in der Arktis schmilzt, entstehen neue Handelsrouten, etwa die Nordostpassage ... Alternative zum Suezkanal wird"", glaubt die ...",negativ,de
Die polare Seidenstraße | Chinas neue Seidenstraßen | bpb.de,https://www.bpb.de/shop/zeitschriften/apuz/chinas-neue-seidenstrassen-2022/514463/die-polare-seidenstrasse/,"Oct 21, 2022 ... Erstens ist China an dem Import von (insbesondere) fossilen Rohstoffen aus der russischen Arktis ... alternative Route. Erst seit den späten ...",negativ,de
Die Nordostpassage als Alternative zu den bestehenden ...,https://core.ac.uk/download/pdf/18234402.pdf,"werden, dass aufgrund der Schiffsgrössenentwicklung die Route über die Arktis an Attraktivität hinzugewinnt. BEDEUTUNG FÜR DIE ROUTENWAHL: Aus logistischer ...",negativ,ac.uk
Arktis und Südchinesisches Meer | Meere und Ozeane | bpb.de,https://www.bpb.de/shop/zeitschriften/apuz/261378/arktis-und-suedchinesisches-meer/,"Dec 15, 2017 ... [7] Eine konkurrenzfähige Alternative zu den Südrouten sind arktische Seewege also nicht unbedingt. Aufgrund der zurückgehenden Eisbedeckung des ...",neutral,de
"Når isen i Arktis smelter, opstår muligheder for at ændre ...",https://videnskab.dk/kultur-samfund/naar-isen-i-arktis-smelter-opstaar-nye-muligheder-for-at-aendre-verdensordenen-gennem-sejlruter/,"Jan 21, 2025 ... Økonomiske muligheder flyder på handel ... Et kort I et klimascenarie med høje drivhusgasudledninger kunne de alternative sejlruter se således ud, ...",neutral,dk
Wem gehört die Arktis? - Archiv | Wiener Zeitung,https://www.wienerzeitung.at/h/wem-gehort-die-arktis,"Aug 31, 2022 ... Es geht um die dort lagernden Rohstoffe Öl und Gas, aber auch um Sicherheitspolitik und die Erschließung neuer Verkehrs- und Handelsrouten.",negativ,at
Machtansprüche in der Arktis – Alle wollen an den Nordpol ...,https://detektor.fm/politik/alle-laender-beanspruchen-die-arktis,"Oct 22, 2015 ... Die Arktis ist bei vielen Staaten sehr begehrt. Sie wollen an die Rohstoffe und neue Handelsrouten etablieren. Die arktischen Landflächen ...",negativ,fm
"Feuerland Reise und Patagonien, Reiseziele am Ende der Welt",https://www.explora.com/de/feuerland-reise/,Die Magellanstraße verbindet den Atlantik mit dem Pazifik und bietet eine wichtige Alternative für den Handel und die Schifffahrt zwischen diesen beiden Ozeanen ...,negativ,com
Schifffahrtsstudie 2022 | AGCS,https://commercial.allianz.com/news-and-insights/news/safety-shipping-review-2022-de.html,"May 10, 2022 ... Eine wachsende Zahl von Schiffen stellt bereits auf Flüssigerdgas (LNG) um, während andere alternative Kraftstoffe in der Entwicklung sind, ...",neutral,com
Dünnes Eis für Liniendienste - DVZ,https://www.dvz.de/unternehmen/see/detail/news/duennes-eis-fuer-liniendienste.html,"Oct 9, 2014 ... Mit Biodiesel im Tank bis zum Nordpol. Klimawandel, neue Handelsrouten, alternative Treibstoffe - die Schifffahrt wird sich bis 2050 massiv ...",negativ,de
Nordwestpassage – Wikipedia,https://de.wikipedia.org/wiki/Nordwestpassage,"Die Nordwestpassage ist der etwa 5780 Kilometer lange Seeweg, der nördlich der Festlandmasse des amerikanischen Kontinents den Atlantischen Ozean mit dem ...",negativ,org
RAOnline EDU: Transarktische Seewege - Nördlicher Seeweg - Der ...,https://www.raonline.ch/pages/edu/arc/arc_seaway1702.html,Arktis - Transarktische ... Die Nordost-Passage gilt für Reedereien als zeit- und treibstoffsparende Alternative zur herkömmlichen Europa-Asien-Route.,negativ,ch
“Weather Kitchen” and Climate-Machine: Wissenschaftsjahr,https://www.wissenschaftsjahr.de/2016-17/weiterfuehrende-informationen/englisch/science-year-201617-seas-and-oceans/fields-of-action/weather-kitchen-and-climate-machine.html,Arktis und Antarktis · Wetterküche und Klimamaschine ... Experts suggest that we at least consider an alternative to our daily car rides to the workplace.,neutral,de
Nach dem ewigen Eis: Droht der große Ressourcenkrieg in der Arktis?,https://www.derstandard.at/story/2000119484514/nach-dem-ewigen-eis-droht-der-grosse-ressourcenkrieg-in-der,"Aug 23, 2020 ... es gibt keine Alternative ... In dem Fall der Arktis kommen Kohlenwasserstoffe hinzu und die Handelsrouten, die Fahrzeiten verkürzen und Kosten ...",negativ,at
Russlands Zugang zum Atlantik: Die Barentssee ist entscheidend,https://www.nzz.ch/pro/russland-arkis-die-barentssee-ist-fuer-russland-ein-schluesselgebiet-im-konflikt-mit-dem-westen-es-ist-der-einzige-zugang-zum-atlantik-ld.1863386,"Jan 8, 2025 ... Russland hat durch den Angriff auf die Ukraine zwei seiner drei Zugänge zum Atlantik verloren. Nur noch die Barentssee in der Arktis ist ...",negativ,ch
Handelsrouten zwischen China und Europa - HDS International Group,https://www.hds-international.group/handelsrouten-zwischen-china-und-europa/,"Dadurch verlor die Kap-Route noch mehr an Bedeutung, obwohl sie nach wie vor eine alternative Ausweichroute darstellt, wenn der Suezkanal in irgendeiner Weise ...",negativ,group
Der Kampf um die Arktis,https://www.handelsblatt.com/politik/international/russland-und-usa-der-kampf-um-die-arktis/20442350.html,"Oct 12, 2017 ... Manche sprechen vom neuen Kalten Krieg, nur mit anderem Schauplatz. Der Wettlauf um die Arktis heizt die Rivalität zwischen den Großmächten ...",negativ,com
Welche wirtschaftlichen und ökologischen Auswirkungen haben das ...,https://bildungsserver.hamburg.de/resource/blob/756244/66cd7751585f72c73ebeeabc4698d81a/2014-nordostpassage-data.pdf,"Jun 9, 2014 ... Die Arktis ist die von dem Klimawandel am stärksten betroffene Region. ... südlichen Alternative. Die Verschmutzung des Wassers trifft die ...",negativ,de
4.7 Perspektiven der arktischen Seefahrt in der Zukunft,https://www.klima-warnsignale.uni-hamburg.de/wp-content/uploads/pdf/de/meere/warnsignal_klima-die-meere-kapitel-4_7.pdf,"alternative interkontinentale Handelsrouten fungieren, sondern auch für arktischen Kreuzfahrttourismus und insbesondere zur Erschließung neuer ...",neutral,de
"Indien, Iran, Kasachstan: Das sind Russlands neue Handelswege ...",https://www.handelszeitung.ch/politik/das-sind-russlands-neue-handelswege-648785,"Oct 26, 2023 ... Die Route gilt als schnellere Alternative zur Schifffahrt zwischen ... Arktis. Quelle: Keystone . Der russische Minister für die ...",negativ,ch
Trump und der Grönland-Poker: Amerikanische Begehrlichkeiten im ...,https://www.investmentweek.com/trump-und-der-gronland-poker-amerikanische-begehrlichkeiten-im-hohen-norden/,"Mar 28, 2025 ... ... Alternative hätten. Grönland sei entscheidend für die internationale ... Arktis eine zentrale Rolle im internationalen Klima- und ...",negativ,com
"Panamakanal: Geschichte, Technik und globale Bedeutung",https://www.toernfinder.de/segelblog/panamakanal-geschichte-technik-und-globale-bedeutung/,"Aug 1, 2024 ... In Konkurrenz zum Suezkanal bietet der Panamakanal eine effiziente und kostengünstige Alternative für den globalen Handel. Wirtschaftliche ...",neutral,de
Die Klimaschutzpolitik der EU,https://www.europarl.europa.eu/RegData/etudes/STUD/2021/689378/EPRS_STU(2021)689378_DE.pdf,"Feb 19, 2021 ... alternative Kraftstoffe für Fahrzeuge mit Verbrennungsmotor wie auch alternative ... Handelsrouten in der Arktis nutzbar. Voraussetzung hierfür ...",negativ,eu
Der Klimawandel macht's möglich: Frachtschiffe nördlich von ...,https://www.euractiv.de/section/energie-und-umwelt/news/der-klimawandel-machts-moeglich-frachtschiffe-noerdlich-von-russland/,"Aug 24, 2018 ... ... Arktis nach Nordeuropa schicken. ... Nach eigener Aussage sieht die dänische Reederei derzeit „die Nordostpassage nicht als Alternative zu unseren ...",negativ,de
Antagonismen in der Nachbarschaft der Europäischen Union,https://www.bertelsmann-stiftung.de/fileadmin/files/user_upload/201104_BSt_ID806_Schlu__sselstaaten_3_Kaukasus_Voe_online.pdf,"Apr 27, 2011 ... Vor diesem Hintergrund ist es ein primäres Ziel der Islamischen Republik, alternative und von US-Sanktio- nen abgeschottete Handelsrouten zu ...",neutral,de
Trumps Grönland-Ambitionen: Schauplatz geopolitischer Rivalität ...,https://usaexperte.com/2025/01/12/trumps-groenland-ambitionen-schauplatz-geopolitischer-rivalitaet/,"Jan 12, 2025 ... Diese Route gewinnt durch das schmelzende Eis in der Arktis an ... Alternative Worlds“, den jeder Präsident zu Beginn seiner Amtszeit erhält.",neutral,com
Auf leichten Wanderungen durch das historische Japan | 16 Tage ...,https://www.diamir.de/japan/reise/JAPKIS,"Alternative anfragen. Ausgebucht, 11.11.25 – 26.11 ... Heute wandern Sie auf dem Nakasendo – einer der historischen Handelsrouten zwischen Tokio und Kyoto.",neutral,de
Schiffbarer Nordpol - wissenschaft.de,https://www.wissenschaft.de/technik-digitales/schiffbarer-nordpol/,"Mar 4, 2013 ... Es öffnen sich auch zahlreiche alternative Routen weiter im Norden, die eine noch schnellere Fahrt ermöglichen. ... Arktis verkehrenden Schiffe ...",negativ,de
Frachtschiffreisen und Rundreisen: Langsamreisen,https://www.langsamreisen.de/frachtschiffreisen,Frachtschiffreisen für alle. Reisen mit dem Frachter sind eine gute Alternative für Menschen mit Flugangst. Sie geben dem Sabbatjahr einen zusätzlichen Spirit ...,positiv,de
Switzerland and the Arctic | Foraus,https://www.foraus.ch/wp-content/uploads/2020/10/20201028_Switzerland-and-the-Arctic_WEB.pdf,"Oct 28, 2020 ... Handelsrouten für die internationale. Schifffahrt und einige der enormen Ressourcenschätze der Arktis werden leichter zugänglich. Zunehmende ...",negativ,ch
Antrag Türkei: BRICS oder NATO?,https://www.kettner-edelmetalle.at/wissen/balanceakt-der-tuerkei-brics-oder-nato,Diese Initiativen sollen alternative Handelsrouten zum Suezkanal und ... Warum der Kampf um die Vorherrschaft in der Arktis und damit das Kriegsgefahr zwischen ...,negativ,at
Gefährdung der arktischen Umwelt | Umweltbundesamt,https://www.umweltbundesamt.de/themen/nachhaltigkeit-strategien-internationales/arktis/umweltschutz-in-der-arktis/gefaehrdung-der-arktischen-umwelt,"Feb 1, 2016 ... Modellgebiet Arktis. Die Arktis ist eine Region, die sehr sensibel auf Veränderungen reagiert. Vor allem menschliche Aktivitäten – sowohl in der ...",negativ,de
Zukunft der maritimen Wirtschaft gestalten,https://www.reederverband.de/de/system/files/publikationen/deutsche_seeschifffahrt/ds-q125.pdf,"Arktis-Experte Dr. Volker Rachhold. MARITIME LOGISTIK. 10 MELDUNGEN. Neues ... Da- zu gehört es, alternative Handelsrouten zu. Engpässen wie dem Suez- oder ...",neutral,de
Switzerland and the Arctic,https://www.research-collection.ethz.ch/bitstream/handle/20.500.11850/451392/3/20201028_Switzerland-and-the-Arctic_WEB.pdf,"Oct 28, 2020 ... Handelsrouten für die internationale. Schifffahrt und einige der enormen Ressourcenschätze der Arktis werden leichter zugänglich. Zunehmende ...",negativ,ch
Wie man nach Crown Falls zieht? : r/anno,https://www.reddit.com/r/anno/comments/scbme6/how_to_move_to_crown_falls/?tl=de,"Jan 25, 2022 ... Piraten werden ebenfalls auf Handelsstatus aufgewertet, daher liegt der Fokus nicht auf Krieg oder dem Schutz von Handelsrouten. Auf diese Weise ...",positiv,com
Mit dem Unfall im Suezkanal „belebt“ Russland die Nordseeroute ...,https://www.agenzianova.com/de/news/con-lincidente-nel-canale-di-suez-la-russia-rilancia-la-rotta-del-mare-del-nord/,"Mar 27, 2021 ... ... Alternative zum Suezkanal – einer der wichtigsten globalen Handelsrouten ... Erstens gebe es entlang der Arktisroute „viel mehr Platz ...",negativ,com
Die sieben entscheidenden Meerengen | The Pioneer,https://www.thepioneer.de/originals/thepioneer-expert/articles/die-sieben-entscheidenden-meerengen,"Jan 15, 2024 ... ... Handelsrouten stellt auch die Arktis dar. Einerseits stellen mögliche eisfreie Handelsrouten eine wichtige Alternative für den ...",negativ,de
Die maritimen Engpässe des globalen Handels | Roland Berger,https://www.rolandberger.com/de/Insights/Publications/Die-maritimen-Engp%C3%A4sse-des-globalen-Handels.html,"Jul 25, 2022 ... In jüngster Zeit wird viel über neue Wasserstraßen diskutiert, beispielsweise durch die Arktis. ... Gibt es alternative Routen? Falls ja: Wie viel ...",negativ,com
Russland plant militärischen Schutz beim Bau des Nicaragua ...,https://amerika21.de/2014/06/102042/russland-nicaragua-kanal,"Jun 7, 2014 ... ... Handelsrouten. In Russland gibt es aber Stimmen, die das Projekt ... Arktisroute über eine Alternative verfüge. Keine Werbung, keine ...",negativ,de
Der lange Weg einer Jeans,https://storymaps.arcgis.com/stories/256165a594fe4e3b8569886d76c422d3,"Nov 1, 2020 ... Um möglichst hohe Gewinne für den Handel zu ... Nicht zuletzt sind Secondhand-Jeanshosen eine gute Alternative zu einer neuen Jeans.",neutral,com
Länderporträt Türkei: cargo-partner,https://www.cargo-partner.com/de/trendletter/issue-18/laenderportraet-tuerkei,In bester Tradition werden auch heute noch die „New Silk Road“ als Handelsroute zwischen Asien und Europa gepflegt. So führt die aktuell wichtigste Verbindung ...,negativ,com
Was sich China von der Partnerschaft mit Iran verspricht | zenith.me,https://magazin.zenith.me/de/wirtschaft/die-china-iran-allianz,"Oct 21, 2020 ... Aus Chinas Perspektive reduzieren Investitionen entlang der Handelsrouten Transportkosten und schaffen neue Absatzmärkte, während Investitionen ...",neutral,me
Geopolitische Folgewirkungen des Klimawandels in der Arktis,https://www.ipw.rwth-aachen.de/wp/wp-content/uploads/SSP_63_Uebachs_Geopolitische-Folgewirkungen-des-Klimawandels-in-der-Arktis.pdf,"Aug 2, 2007 ... ... Alternative zu den traditionellen Routen darstellen. Das größte ... Arktis wie die Umsetzung einer Handelsroute entlang der NSR (vgl.",negativ,de
ANDERS,https://www.fairbindung.org/wp-content/uploads/Broschuere-Wirtschaft-anders-machen.pdf,"Wir haben diese Struktur gewählt, um eine Alternative zu allgemein geltenden ... ka, aber auch Völker in der Arktis, Nor- deuropa, Asien, Ozeanien oder im ...",neutral,org
Mit dem Unfall im Suezkanal „belebt“ Russland die Nordseeroute ...,https://www.agenzianova.com/de/news/con-lincidente-nel-canale-di-suez-la-russia-rilancia-la-rotta-del-mare-del-nord/,"Mar 27, 2021 ... ... Alternative zum Suezkanal – einer der wichtigsten globalen Handelsrouten ... Erstens gebe es entlang der Arktisroute „viel mehr Platz ...",negativ,com
Der Beginn der Neuzeit – Die Welt um 1500 | Herder.de,https://www.herder.de/geschichte-politik/neuzeit/die-welt-um-1500/,"Oct 9, 2018 ... ... Handelsrouten Kleinasiens und des Nahen Ostens umgangen waren. Der ... Arktis in den Traditionen der Inuit z. T. bis heute. Doch auch ...",negativ,de
Die sieben entscheidenden Meerengen | The Pioneer,https://www.thepioneer.de/originals/thepioneer-expert/articles/die-sieben-entscheidenden-meerengen,"Jan 15, 2024 ... ... Handelsrouten stellt auch die Arktis dar. Einerseits stellen mögliche eisfreie Handelsrouten eine wichtige Alternative für den ...",negativ,de
Strategische Souveränität in der südöstlichen Nachbarschaft der EU ...,https://www.boell.de/de/2021/01/25/strategische-souveraenitaet-der-suedoestlichen-nachbarschaft-der-eu-das-schwarze-meer,"Jan 25, 2021 ... Aufgrund begrenzter Ressourcen wurde unter Wladimir Putin die russische Außen- und Sicherheitspolitik entlang einer Nord-Süd Achse (Arktis ...",negativ,de
"Arktis: Jedem seine Scholle, Tageszeitung junge Welt, 29.03.2025",https://www.jungewelt.de/artikel/496955.arktis-jedem-seine-scholle.html,"Mar 29, 2025 ... Die Alternative dazu lag in EU-europäischer und wohl insbesondere auch in deutscher Hand: Ausbau statt Stopp der Kooperation mit Russland ...",negativ,de
Deutschland und seine „Zeitenwende“ - An der Realität vorbei ...,https://www.cicero.de/aussenpolitik/deutschland-und-seine-zeitenwende-an-der-realitat-vorbei,"May 6, 2024 ... Viele, mit denen ich sprach, erwähnten Indien nicht nur als Standort für eine alternative Handelsroute, sondern auch als alternativen ...",neutral,de
Freiburger Informationspapiere zum Völkerrecht und Öffentlichen ...,https://uni-freiburg.de/jura-ioeffr2/wp-content/uploads/sites/163/FIP_6_2013_Hoefelmeier_Nordwestpassage.pdf,"Jun 5, 2013 ... Handelsrouten der Schifffahrt unter Berücksichtigung der ... der Arktis unter das Seerechtsregime fallen lässt, widerspiegelt.69 ...",negativ,de
Diese Karte erklärt die 8 Engpässe des Welthandels | Perspective ...,https://perspective-daily.de/article/3075-diese-karte-erklaert-die-8-engpaesse-des-welthandels/probiere,"Apr 12, 2024 ... Die alternative Route für die übrigen Frachter: einmal rund um Südamerika. ... Neue Handelsrouten, sobald das Eis der Arktis schmilzt: Darauf ...",negativ,de
Praxis Geographie 2016 Jahresinhaltsverzeichnis THEMENHEFTE ...,https://www.geographiedidaktik.uni-bayreuth.de/pool/dokumente/Jahresinhaltsverzeichnisse_PraxisGeographie_2016-2000.pdf,"Nov 29, 2007 ... Arktis am Beispiel Norwegens (Sekundarstufe II). 9 20. Siegfried ... Alternative Landwirtschaft und fairer Handel. Ein indonesisches Expo ...",neutral,de
"Von Fischen, Fischern und Piraten – Wissenschaft & Frieden",https://wissenschaft-und-frieden.de/artikel/von-fischen-fischern-und-piraten/,"Damals ging es um »Terrorismus«, heute geht es um Handelsrouten. Dabei ... Alternative zur Verfügung. Allerdings ließ der damalige UN-Beschluss die Tür ...",negativ,de
Russland plant bis 2022/23 eine ganzjährige Schifffahrt auf der ...,https://www.seereisenportal.de/news/kreuzfahrt-news-schifffahrtsnachrichten/russland-plant-bis-202223-eine-ganzjaehrige-schifffahrt-auf-der-nordseeroute-per-dekret-verkuendet-p/,"Oct 21, 2021 ... Moskau sieht die Nördliche Seeroute als ein vorrangiges Projekt an, das letztendlich eine alternative Handelsroute zwischen Asien und Europa ...",negativ,de
Stufe 300 erreichen????? - Allgemeines Forum zu Anno 2205 ...,https://www.annozone.de/forum/thread/15935-stufe-300-erreichen/,"Nov 11, 2019 ... Habe inzwischen Stufe 154 und trotz Ausbau der Orbitalstation, Nexusnutzung und Handelsrouten ... Arktis. Siehe Oben, z.T. noch sehr Viel Platz, ...",neutral,de
"Exterritoriale Ressourcen: Die Diskussion um die Tiefsee, die Pole ...",https://www.diva-portal.org/smash/get/diva2:755460/FULLTEXT01.pdf,"Oct 14, 2014 ... Die Arktis bildet nur ein Beispiel für die verschiedenen möglichen diskursi- ... Alternative Narratives for the Modern Era, in: American ...",negativ,org
