Titel,URL,Beschreibung,Sentiment,Top-Level-Domain
Georgios Christofis - Advisor - | Ministry of Maritime Affairs and ...,https://gr.linkedin.com/in/georgios-christofis-28958282,Advisor at Minisrty of Maritime Affairs and Insular Policy · Εμπειρία: Ministry of Maritime ... Hochschule für Technik und Wirtschaft des Saarlandes Γραφικός ...,neutral,com
The Economic Impacts of the US-China Trade War,https://www.nber.org/system/files/working_papers/w29315/w29315.pdf,"as export controls for national security purposes (e.g., semiconductors), requirements of export licenses to export to particular entities, a reclassification ...",negativ,org
Anmeldung 9. Maritime Zukunftskonferenz,https://events.rostock.ihk.de/9zukunftskonferenzdermaritimenwirtschaftmv,Maritime Wirtschaft – Vorreiter für Digitalisierung und Cyber Security. 15:00 Uhr Impulsvortrag Vorteile durch IT-Vernetzung versus Challenge Cyber Security,positiv,de
Mittler Report Verlag: Home,https://mittler-report.de/,"Politik, Streitkräfte und Wirtschaft. European Security & Defence ... Maritime Defence Monitor · wwi – Wehrwirtschaft · EDD – European Defence Daily ...",positiv,de
Insurability of Cyber Risk: An Empirical Analysis,https://www.internationalinsurance.org/sites/default/files/2018-03/Insurability%20of%20Cyber%20Risk.pdf,sites/default/files/publications/cybersecurity-insurance-read-out-report. ... KPMG (2013) e-Crime – Computerkriminalität in der deutschen Wirtschaft mit ...,negativ,org
Simple Impact Factors for Economics Journals | IDEAS/RePEc,https://ideas.repec.org/top/top.journals.simple.html,"Wirtschaft und Gesellschaft - WuG, Kammer für Arbeiter und Angestellte ... Constanta Maritime University Annals, Constanta Maritime University, 0.109, 17 ...",neutral,org
Moderatorin - Alexa von Busse,https://www.vonbusse.com/moderatorin/,"Daten, Datenschutz und Cybersecurity. Erneuerbare Energien und Rohstoffe. Air & Space, maritime Wirtschaft und Automobile. Finanzen. Gründer- und. Start-up- ...",neutral,com
Germany's Cybersecurity Architecture,https://www.interface-eu.org/storage/archive/files/11thed_cybersecurityarchitecture.pdf,"trative agreement with the BSI to strengthen cybersecurity in maritime shipping. ... 244 Polizei Berlin, Zentrale Ansprechstelle Cybercrime für die Wirtschaft ...",positiv,org
Zwei Vorreiter für Port-Cybersecurity - Logistics Pilot,https://www.logistics-pilot.com/zwei-vorreiter-fuer-port-cybersecurity/,Im November war ich beispielsweise in Lissabon bei einem internationalen Cybersecurity-Workshop für die maritime Wirtschaft. Das macht für mich auch den ...,negativ,com
Statistics Netherlands | CBS,https://www.cbs.nl/en-gb,Security and justice · Traffic and transport · Leisure and culture · Regional · About us · Language: Nederlands (NL) · Population 18.0 million Population.,positiv,nl
Allianz für Sicherheit in der Wirtschaft: Andreas Kaus in den NRW ...,https://www.koetter.de/unternehmen/presse/pressedetailseite/allianz-fuer-sicherheit-in-der-wirtschaft-andreas-kaus-in-den-nrw-vorstand-berufen,"Jun 15, 2023 ... Maritime Security · Maritime Security · Sicherheit für Häfen & Schiffe ... Security Gruppe: „NRW-Unternehmen sind begehrte Angriffsziele für ...",positiv,de
"A JOINT APPROACH TO SAFETY, SECURITY AND RESILIENCE ...",https://open.lnu.se/index.php/rea/article/download/2382/2154/5605,"of accidents between the plant and e.g. ships), security (SSR2, defense against e.g. attacks, ... [3] Bundesministerium für Wirtschaft und Energie. (2019) ...",positiv,se
Markus Egger - Key-Account-Manager - Glutz | LinkedIn,https://ch.linkedin.com/in/markus-egger-jura/en,Eco-Partner for the best security and comfort solution in access to ... WISS Schulen für Wirtschaft Informatik Immobilien Graphic · WISS Schulen für ...,positiv,com
