Titel,URL,Beschreibung,Sentiment,Top-Level-Domain
Die Schiffszimmerer: Allgemeine Deutsche Schiffszimmerer ...,https://www.schiffszimmerer.de/,Genossenschaftliches Wohnungsunternehmen in Hamburg. Attraktiver Wohn- und Lebensraum zu angemessenen Preisen.,negativ,de
"German Christmas Songs: Es kommt ein Schiff, geladen – A Ship is ...",https://morethanbeerandschnitzel.com/es-kommt-ein-schiff-geladen-a-ship-is-coming-laden/,"Dec 10, 2020 ... The melody to this song dates back to the first half of the 15th century and originated probably in the Alsace.",neutral,com
Briese Schiffahrt,https://briese.de/,BRIESE SCHIFFAHRT. BRIESE SCHIFFAHRT manages a fleet of more than 130 ... Germany. BRIESE SCHIFFAHRT. ABOUT. FLEET. CAREER. CONTACT. IMPRINT. Privacy Policy.,neutral,de
Stiftung Schifffahrtsstandort Deutschland: Home,https://www.stiftung-schifffahrtsstandort.de/,Dieser Ausgleich kann entweder: durch die Ausbildung von Schiffsmechanikern oder Offiziersassistenten auf dem jeweiligen ausgeflaggten Schiff oder; durch die ...,negativ,de
Geesthacht,https://www.dlr.de/de/das-dlr/standorte-und-bueros/geesthacht,▾Deutsche ... Am Standort Geesthacht arbeiten Wissenschaftlerinnen und Wissenschaftler an innovativen Technologien zur Dekarbonisierung der Schifffahrt ...,neutral,de
Reedereien in der Krise: Die deutsche Schifffahrt steht vor einem ...,https://www.wiwo.de/unternehmen/dienstleister/reedereien-in-der-krise-die-deutsche-schifffahrt-steht-vor-einem-schicksalsjahr/19203054.html,"Jan 3, 2017 ... Und doch hat sich die Krise der Schifffahrt, die ins neunte Jahr geht, nochmals verschärft. Der Boden ist wohl endgültig erreicht. Viele Schiffe ...",negativ,de
Deutsche Schiff- und Maschinenbau – Wikipedia,https://no.wikipedia.org/wiki/Deutsche_Schiff-_und_Maschinenbau,Deutsche Schiff- und Maschinenbau ... Deutsche Schiff- und Maschinenbau Aktiengesellschaft (forkortet: DeSchiMAG) var et samarbeid mellom åtte tyske skipsverft i ...,neutral,org
Vanguard Logistics: Home,https://www.vanguardlogistics.com/,GERMANY; GHANA; GIBRALTAR; GREECE; GREENLAND; GRENADA; GUADELOUPE; GUAM; GUATEMALA; GUERNSEY; GUINEA; GUINEA-BISSAU; GUYANA; HAITI; HEARD ISLAND AND MCDONALD ...,neutral,com
House Democrats subpoena Deutsche Bank in Trump investigation ...,https://www.politico.eu/article/us-house-democrats-subpoena-deutsche-bank-in-donald-trump-investigation/,"Apr 16, 2019 ... House Democrats on Monday issued a subpoena to the German lender Deutsche ... Schiff (D-Calif.), the House intelligence chairman. “We look forward ...",positiv,eu
Fragen zur Ausflaggung und Beflaggung in der deutschen ...,https://www.bundestag.de/resource/blob/691738/c129ec07aa98c14fdd83146722acf181/wd-5-002-20-pdf-data.pdf,"Jan 30, 2020 ... Page 1. © 2020 Deutscher Bundestag. WD 5 - 3000 - 002/20. Fragen zur Ausflaggung und Beflaggung in der deutschen Schifffahrt. Sachstand.",positiv,de
Wasserstraßennetz – Deutscher Wasserstraßen- und ...,https://www.schifffahrtsverein.de/wasserstrassennetz,Schifffahrt > Wasserstraßennetz. Die Bundeswasserstraßen gliedern sich nach dem Wasserwegerecht in Binnenwasserstraßen und Seewasserstraßen. Bei den ...,negativ,de
(T)RAUMSCHIFF SURPRISE PERIODE 1 – 6 Minuten Sneak Peek ...,https://www.youtube.com/watch?v=kP4F8jpTh_c&pp=0gcJCdgAo7VqN5tD,"Aug 24, 2017 ... (T)RAUMSCHIFF SURPRISE PERIODE 1 – 6 Minuten Sneak Peek Deutsch HD German (2017) ... Comments193. SP-DR123. Lustigerweise bis heute der deutsche ...",positiv,com
URTEIL DES GERICHTSHOFES (Erste Kammer) 1. April 2004 * In ...,https://eur-lex.europa.eu/legal-content/DE/TXT/PDF/?uri=CELEX:62002CJ0389,"6 Den Begriff der gewerblichen Schifffahrt legt der deutsche Bundesfinanzhof in gefestigter Rechtsprechung dahin aus, dass er sich allein auf die ...",negativ,eu
The Heidelberg Peri‐anaesthetic Questionnaire – development of a ...,https://associationofanaesthetists-publications.onlinelibrary.wiley.com/doi/abs/10.1111/j.1365-2044.2008.05576.x,"Sep 5, 2008 ... Schiff,. M. Schiff. Psychologist, Faculty of Social Sciences, University Mannheim, Mannheim, Germany. Search for more papers by this author.",neutral,com
(PDF) Hochfrequenzdaten aus der Schifffahrt als Indikator für den ...,https://www.researchgate.net/publication/351640476_Hochfrequenzdaten_aus_der_Schifffahrt_als_Indikator_fur_den_deutschen_AussenhandelEconomic_headlights_High-frequency_data_from_shipping_as_an_indicator_of_German_foreign_trade,"Feb 6, 2025 ... ... Schifffahrt als Indikator für den deutschen AußenhandelEconomic headlights: High-frequency data from shipping as an indicator of German ...",neutral,net
New m‐carborane‐containing polymeric schiff bases - Korshak ...,https://onlinelibrary.wiley.com/doi/abs/10.1002/actp.1989.010400704,"... Deutsche section. New soluble m-carborane-containing polymeric Schiff bases are prepared by polycondensation of m-carboranylenediamine, 1,7-bis(4 ...",positiv,com
