Titel,URL,Beschreibung,Sentiment,Top-Level-Domain
Deutsche Offshore Schifffahrt – Very versatile vessels for the ...,https://deutscheoffshore.com/,Deutsche Offshore Schifffahrt (German Offshore Shipping) will be entering the offshore energy market with four construction commissioning service operation ...,positiv,com
Deutsche Schiff- und Maschinenbau - Wikipedia,https://en.wikipedia.org/wiki/Deutsche_Schiff-_und_Maschinenbau,Deutsche Schiff- und Maschinenbau · Language · Watch · Edit. Learn more. This article needs additional citations for verification. Please help improve this ...,positiv,org
Schiff: Complete Recordings On Philips & DG - Deutsche ...,https://store.deutschegrammophon.com/en/products/heinrich-schiff-schiff-complete-recordings-on-philips-dg,"The limited Edition features 21 CDs, all presented in their original jackets and new liner notes in a 24 pages booklet with many archive photographs.",positiv,com
Schoeller and Deutsche Offshore Schifffahrt sign for newbuild ...,https://splash247.com/schoeller-and-deutsche-offshore-schifffahrt-sign-for-newbuild-quartet-in-china/,"Sep 25, 2024 ... Schoeller Holdings and Deutsche Offshore Schifffahrt have joined forces in the offshore energy sector with four construction commissioning ...",positiv,com
András Schiff - Deutsche Grammophon,https://store.deutschegrammophon.com/en/collections/andras-schiff,"Brahms / Schumann ... CD ... 18,99 ... https://images.bravado.de/prod/product-assets/.",neutral,com
"ANDRÁS SCHIFF AT THE TEATRO OLIMPICO, VICENZA (Visual ...",https://www.deutschegrammophon.com/en/catalogue/products/andras-schiff-at-the-teatro-olimpico-vicenza-visual-album-12740,"András Schiff. June 24, 2022. Filter shops: Audio Video. Streaming Download. Apple Music Album Apple Music Playlist. Label Deutsche Grammophon (DG). UPC",neutral,com
Schoeller Holdings and DOS order four future-ready CSOVs for ...,https://www.offshore-energy.biz/schoeller-holdings-and-dos-order-four-future-ready-csovs-for-offshore-wind-offshore-energy-markets/,"Sep 24, 2024 ... A joint venture (JV) between Schoeller Holdings and Deutsche Offshore Schifffahrt (DOS) has ordered four commissioning service operation vessels (C-CSOVs)",positiv,biz
Schoeller Holdings and Deutsche Offshore Schifffahrt Order Four ...,https://breakbulk.news/schoeller-holdings-and-deutsche-offshore-schifffahrt-order-four-groundbreaking-vessels-for-offshore-energy-sector/,"Sep 24, 2024 ... These vessels, ordered from CSSC Huangpu Wenchong Shipbuilding Co., Ltd., are set to be delivered starting in early 2027, offering a revolutionary approach to ...",neutral,news
ANDRÁS SCHIFF PLAYS BACH (Visual Album) | Deutsche ...,https://www.deutschegrammophon.com/en/catalogue/products/andras-schiff-plays-bach-visual-album-12588,"András Schiff Live from Bachfest 2010, French Suites Nos. 1-6 (BWV 812-817), Overture (Partita) in B Minor “in French Style”, BWV 831, Italian Concerto in F ...",positiv,com
Schoeller Holdings and Deutsche Offshore Schifffahrt Enter Offshore ...,https://www.shipuniverse.com/news/schoeller-holdings-and-deutsche-offshore-schifffahrt-enter-offshore-energy-market/,"Oct 17, 2024 ... The investment by Schoeller Holdings and Deutsche Offshore Schifffahrt underscores the growing recognition that the offshore energy market, ...",positiv,com
German JV Orders Four New Vessels For Offshore Energy,https://www.marinelink.com/news/german-jv-orders-four-new-vessels-517374,"Sep 24, 2024 ... A joint venture between Schoeller Holdings and Deutsche Offshore Schifffahrt has ordered four construction commissioning service operation vessels (C-CSOVs) ...",positiv,com
telekom/das-schiff: This is home of Das Schiff - Deutsche ... - GitHub,https://github.com/telekom/das-schiff,Das Schiff. Das SCHIFF is a GitOps based Kubernetes Cluster as a Service platform almost exclusively built using open-source components. Created by and intended ...,positiv,com
Deutsche Offshore Schifffahrt | LinkedIn,https://de.linkedin.com/company/deutscheoffshore,"which are due to hit the market beginning Q1 2027 and secured additional optional vessels. Established in 2023, Deutsche Offshore Schifffahrt has innovated the ...",positiv,com
Schoeller Holdings and Deutsche Offshore Schifffahrt Commission ...,https://www.bairdmaritime.com/offshore/offshore-support-maintenance/cypriot-german-joint-venture-orders-four-csovs-from-chinese-yard,"Sep 25, 2024 ... Cypriot-German joint venture orders four CSOVs from Chinese yard ... A joint venture company formed by Cyprus-based Schoeller Holdings and ...",neutral,com
Schiff questions Mueller's approach on Deutsche Bank - POLITICO,https://www.politico.com/story/2019/02/10/schiff-mueller-trump-deutsche-bank-1162183,"Feb 10, 2019 ... On NBC's “Meet the Press,” the California Democrat cited reporting that Trump had once sought to fire Mueller over reports that investigators ...",negativ,com
Deutsches Schifffahrtsmuseum,https://www.dsm.museum/,Das Deutsche Schifffahrtsmuseum in Bremerhaven ist ein Forschungsmuseum der Leibniz-Gemeinschaft und ein Ort der Bildung und des Dialogs im Herzen des ...,neutral,museum
Is Schiffahrt still correct or only Schifffahrt nowdays? : r/German,https://www.reddit.com/r/German/comments/1eqs2mw/is_schiffahrt_still_correct_or_only_schifffahrt/,"Aug 12, 2024 ... ""Officially"" the spelling ""Schifffahrt"" is correct and ""Schiffahrt"" is incorrect. Whether the company you work for is as strict as that is a different matter.",positiv,com
New order for 4 C-CSOVs — News Collection — Salt Ship Design,https://www.saltship.com/newscollection/new-c-csov-contract,"Sep 24, 2024 ... A joint venture between Schoeller Holdings and Deutsche Offshore Schifffahrt (German Offshore Shipping) will be entering the offshore energy ...",positiv,com
Schifffahrt - BSH,https://www.bsh.de/DE/THEMEN/Schifffahrt/schifffahrt_node.html,Die deutsche Flaggenstaatverwaltung bietet alle Informationen zur Handelsschifffahrt unter deutscher Flagge und für Seeleute auf einer zentralen ...,negativ,de
Schifffahrt - Translation in English - Langenscheidt dictionary ...,https://en.langenscheidt.com/german-english/schifffahrt,"Translation for 'Schifffahrt' using the free German-English dictionary by LANGENSCHEIDT -– with examples, synonyms and pronunciation.",positiv,com
Deutsche Schiff- und Maschinenbau AG | World War II Database,https://ww2db.com/facility.php?q=219,"Jun 26, 2022 ... The Deutsche Schiff- und Maschinenbau (Deschimag) shipyard in Bremen, Germany had its beginnings in the firm Eisengiesserei & Maschinenbau-Anstalt Waltjen und ...",negativ,com
Deutsche Seeschifffahrt – das Verbandsmagazin | VDR,https://www.reederverband.de/de/der-verband/vdr-publikationen/deutsche-seeschifffahrt-das-verbandsmagazin,Schifffahrt – wenn du „Meer“ wissen willst · Lust auf „Meer“ – unser ... Deutsche Seeschifffahrt – das Verbandsmagazin. Deutsche Seeschifffahrt – aktuelle ...,neutral,de
What a great occasion for a first post as Deutsche Offshore Schifffahrt,https://www.linkedin.com/posts/deutscheoffshore_what-a-great-occasion-for-a-first-post-as-activity-7313227949120409600-zLVH,"Apr 2, 2025 ... What a great occasion for a first post as Deutsche Offshore Schifffahrt: Over the last days we have started comprehensive model testing of ...",positiv,com
Deutsche Flagge,https://www.deutsche-flagge.de/,... aus. Wir unterstützen Reedereien und Seeleute mit Rat und Tat – immer. INNOVATIONSTREIBER. Rückenwind für den Kurs auf die klimaneutrale Schifffahrt.,negativ,de
Personen-Schifffahrt Gebr. Kolb (2025) - All You Need to Know ...,https://www.tripadvisor.com/Attraction_Review-g1029014-d6698481-Reviews-Personen_Schifffahrt_Gebr_Kolb-Briedern_Rhineland_Palatinate.html,"However, the entire trip we were treated to / tortured by German Schlager at an unpleasantly loud noise. ... EuropeGermanyRhineland-PalatinateBriedernThings to Do ...",negativ,com
Schiff Questions Depth of Mueller Probe into Trump and Deutsche ...,https://fortune.com/2019/02/11/schiff-trump-deutsche-bank/,"Feb 11, 2019 ... The House Intelligence chief appeared on NBC's ""Meet the Press"" to explain why he's subpoenaing Deutsche Bank.",positiv,com
Kategorie:Schifffahrt (Deutschland) – Wikipedia,https://de.wikipedia.org/wiki/Kategorie:Schifffahrt_(Deutschland),"S · Schiff (Deutschland) (14 K, 61 S) · Schiffbau (Deutschland) (1 K, 32 S) · Seebrücke in Deutschland (2 K, 1 S) · Seefahrt (Deutschland) (4 K, 25 S).",neutral,org
"Deutsche Offshore Schifffahrt, Bygg nr. ? ved CSSC Huangpu ...",http://skipsfarts-forum.net/index.php?threads/deutsche-offshore-schifffahrt-bygg-nr-ved-cssc-huangpu-wenchong-shipbuilding-co-ltd-wind-energy-ship-salt-ship-design-4x-tbn.2971/,"Sep 24, 2024 ... The C-CSOV represents a major innovation in the offshore shipping market. While the CSOV designs of today's fleet are tailored to deployment ...",positiv,net
"Deutsche Schiff und Maschinenbau AG, Bremen",https://www.uboat.net/technical/shipyards/seebeck.htm,"16 commissioned U-boats ... The first U-boat launched by Deutsche Schiff und Maschinenbau AG in Bremen was the U-161 on 1 Mar 1941, but the last U-boat launched ...",positiv,net
Heinrich Schiff – Complete Recordings On Philips And Deutsche ...,https://www.discogs.com/release/26158496-Heinrich-Schiff-Complete-Recordings-On-Philips-And-Deutsche-Grammophon,"Sep 21, 2024 ... View credits, reviews, tracks and shop for the 2021 CD release of ""Complete Recordings On Philips And Deutsche Grammophon"" on Discogs.",positiv,com
Bodensee-Schifffahrt - Bodensee Schiffsbetriebe GmbH | BSB,https://www.bsb.de/de,Deutsch · Wetter am Bodensee. SAISONSTART 2025. Trotz Niedrigwasser: Wir starten ... Mit einem BSB-Gutschein verschenkt man viel mehr als nur eine Schifffahrt: ...,neutral,de
Schifffahrt - Deutsches Museum,https://www.deutsches-museum.de/museumsinsel/ausstellung/schifffahrt,In der großen Schifffahrtshalle und im Untergeschoss des Deutschen Museums lässt sich viel über Schifffahrt entdecken. Die Ausstellung zeigt die Entwicklung der ...,negativ,de
Heinrich Schiff Complete Recordings on Philips and Deutsche ...,https://classicsdirect.com.au/products/heinrich-schiff-complete-recordings-on-philips-and-deutsche-grammophon-21cd,"The limited Edition features 21 CDs, all presented in their original jackets and new liner notes in a 24 pages booklet with many archive photographs.",positiv,com.au
Schifffahrt und Inselbahn Wangerooge,https://www.siw-wangerooge.de/siw-de,Melden Sie sich gerne bei uns unter: siw-gruppen@deutschebahn.com. Hunde. Für Hunde (auch kleine Hunde im Behältnis) ist stets der Fahrpreis wie für allein ...,neutral,de
Potenzialstudie zu Betankungsinfrastrukturen für kohlenstoffarme ...,https://www.now-gmbh.de/wp-content/uploads/2024/04/NOW_Abschlussbericht-Potenzialstudie-Betankungsstrukturen.pdf,die Kraftstoffversorgung der Schifffahrt in Deutschland modelliert und Bunkerkonzepte vorgestellt sowie bewertet. ... Abbildung 7 | Main Engine Fuel Type der ...,negativ,de
Rantzau Group,https://www.rantzau.de/,"The Deutsche Afrika-Linien/John T. Essberger Group of Companies consists of the Deutsche Afrika-Linien operating liner services to Southern and East Africa, ...",neutral,de
Generaldirektion Wasserstraßen und Schifffahrt (GDWS),https://www.gdws.wsv.bund.de/DE/startseite/startseite_node.html,Das deutsche Mehrzweckschiff Mellum befindet sich auf dem Weg zu den brennenden Schiffen vor der englischen Ostküste. Fünf Feuerlöschmonitore sind nur ein Teil ...,neutral,de
Deutsche Schifffahrt: Land in Sicht,https://store.pwc.de/de/publications/deutsche-schifffahrt-land-in-sicht,Der Anteil der Kurzarbeit ist deutlich zurückgegangen und Investitionen und Neueinstellungen sind geplant. Damit scheint die Talsohle des Jahres 2010 ...,negativ,de
Kraftstoff-Analyse in der Schifffahrt nach Schiffssegmenten - DMZ ...,https://dmz-maritim.de/energietraeger-der-zukunft-kraftstoff-analyse-in-der-schifffahrt-nach-schiffssegmenten/,"Apr 27, 2022 ... Das Deutsche Maritime Zentrum (DMZ) hat 2021 die Ramboll Deutschland GmbH beauftragt, in einer Studie eine Übersicht der für die Schifffahrt ...",negativ,de
Startseite • Köln-Düsseldorfer,https://www.k-d.com/de/,KD Wertgutschein – verschenken Sie unvergessliche #kdmoments An Bord der KD … Mehr erfahren. Schiff MS RheinVision vor Kölner Dom © KD Deutsche Rheinschiffahrt ...,neutral,com
Schiff questions Mueller's approach on Deutsche Bank - Global ...,https://gnnliberia.com/schiff-questions-muellers-approach-on-deutsche-bank/,"Feb 10, 2019 ... Schiff questions Mueller's approach on Deutsche Bank ... Joel Cholo Brooks is a Liberian journalist who previously worked for several ...",neutral,com
"The Cruise of the German Raider Atlantis, 1940 - 1941 ...",https://www.usni.org/magazines/proceedings/1949/december/cruise-german-raider-atlantis-1940-1941,"The Atlantis, or Schiff 16, as she was officially known, was originally the express cargo ship Goldenfels of the German Hansa Line.",neutral,org
Schwere Zeiten für die deutsche Schifffahrt - iwd.de,https://www.iwd.de/artikel/schwere-zeiten-fuer-die-deutsche-schifffahrt-555575/,"Aug 16, 2022 ... Schwere Zeiten für die deutsche Schifffahrt · Die Pegelstände des Rheins sind so niedrig wie seit 2018 nicht mehr. · Das Niedrigwasser schränkt ...",negativ,de
DOC Offshore: Startseite,https://deutscheoffshore.de/,"Apr 7, 2025 ... Erfahrene Offshore Experten. Die DEUTSCHE OFFSHORE CONSULT GmbH (DOC) ist ein verlässlicher Partner im Management von Projekten im Bereich ...",negativ,de
"Luftfahrt, Schienenverkehr und Schifffahrt: EU investiert 378 ...",https://germany.representation.ec.europa.eu/news/luftfahrt-schienenverkehr-und-schifffahrt-eu-investiert-378-millionen-euro-deutsche-verkehrsprojekte-2023-06-22_de,"Jun 22, 2023 ... 378 Millionen Euro gehen an deutsche Projekte. Das Geld stammt aus der Fazilität „Connecting Europe“ (CEF), dem EU-Instrument für strategische ...",neutral,eu
Deutschland auf Kurs – gemeinsam für eine starke deutsche ...,https://bga.de/fileadmin/user_upload/Publikationen/Positionspapiere/Positionspapiere_Verkehr_Logistik/VDR-Standortpapier_D-Verbaende.pdf,"Sep 24, 2024 ... Deutschland auf Kurs – gemeinsam für eine starke deutsche Schifffahrt! Eine Standortbestimmung. Deutschland hat eine jahrhundertelange ...",neutral,de
Deutsche Gesellschaft für Schiffahrts- und Marinegeschichte e.V. ...,https://www.schiffahrtsgeschichte.de/,"Alles Wissenswerte von der Historie über Ergebnisse, Veranstaltungen und neueste Trends bis hin zur Mitgliedschaft und Beitrittserklärung. Deutsche ...",neutral,de
Vera Schiff - Musée de l'Holocauste Montréal,https://museeholocauste.ca/en/survivors-stories/vera-schiff/,Vera Schiff describes her family's life after Germany occupied Czechoslovakia. J'accepte le cookie youtube. Source: Sarah and Chaim Neuberger Holocaust ...,neutral,ca
"Marcrew Schiffahrt Hamburg, Germany | Crew Management Company",https://marlow-navigation.com/en/marcrew.asp,"Hamburg, Germany. Marcrew Schiffahrts GmbH is a strictly third party crew management company established in Hamburg, Germany in 1999. Marcrew represents the ...",positiv,com
Schifffahrt - Ausstellungen - Stiftung Deutsches Technikmuseum Berlin,https://technikmuseum.berlin/ausstellungen/dauerausstellungen/schifffahrt/,Schifffahrt. „Lebenswelt Schiff“ – die Ausstellung im Deutschen Technikmuseum lässt Sie die Faszination der Seefahrt spüren. Lassen Sie sich inspirieren von der ...,negativ,berlin
Wetter und Klima - Deutscher Wetterdienst - Schifffahrt - 518 kHz ...,https://www.dwd.de/DE/fachnutzer/schifffahrt/funkausstrahlung/navtex/518_emd.html,MetaNavigation · Deutscher Wetterdienst Wetter und Klima aus einer Hand · Navigationsmenue · Breadcrumb- Menü · Sub-Navigations- Menü · Service-Navigations- ...,positiv,de
Deutsche Bucht hat große Bedeutung für internationale Schifffahrt ...,"https://www.ndr.de/nachrichten/info/Deutsche-Bucht-hat-grosse-Bedeutung-fuer-internationale-Schifffahrt,deutschebucht104.html","Oct 26, 2023 ... Deutsche Bucht hat große Bedeutung für internationale Schifffahrt ... Für den Schiffsverkehr hat die Deutsche Bucht in der Nordsee eine sehr große ...",negativ,de
"Schiff - Wiktionary, the free dictionary",https://en.wiktionary.org/wiki/Schiff,German Schiff. Proper noun. edit. Schiff m or f by sense. Schiff: a surname from German. a Jewish surname from Yiddish [in turn from German]. German. edit ...,positiv,org
Forggensee-Schifffahrt - Deutsche Alpenstraße,https://www.deutsche-alpenstrasse.de/de/forggensee-schifffahrt,Forggensee Schifffahrt ... Vom 1. Juni bis Mitte Oktober kann man den Schlosspark rund um Füssen auch vom Schiff aus auf dem größten Stausee Deutschlands erleben.,neutral,de
Riverside Luxury Cruises: Einzigartige Flusskreuzfahrten in Europa,https://riverside-cruises.com/,"Ja, eine Flusskreuzfahrt in Europa mit Riverside Luxury Cruises heißt auch, loszufahren, um sich selbst zu finden. Ehepaar auf einem Riverside-Schiff Mozart ...",neutral,com
Deutscher Marinebund - Das Bündnis für Mensch. Schifffahrt. Meer.,https://deutscher-marinebund.de/,Das Bündnis für Mensch. Schifffahrt. Meer. Dafür stehen wir als größter und ältester maritimer Interessenverband Deutschlands. Unser Wahrzeichen ist das ...,neutral,de
"Declension German ""Schifffahrt"" - All cases of the noun, plural ...",https://www.verbformen.com/declension/nouns/Schifffahrt.htm,"The declension of Schifffahrt as a table with all forms in singular (singular) and plural (plural) and in all four cases nominative (1st case), genitive (2nd ...",neutral,com
"""Deutsche Schifffahrt in Kreuzsee"" - DVZ",https://www.dvz.de/unternehmen/see/detail/news/deutsche-schifffahrt-in-kreuzsee.html,"""Deutsche Schifffahrt in Kreuzsee"". Jahresbericht des Verbands Deutscher Reeder: Branche muss investitionsfähig bleiben und wehrt sich gegen nationale ...",neutral,de
Schiff bases and their amines: Synthesis and discovery of carbonic ...,https://pubmed.ncbi.nlm.nih.gov/30033646/,... Schiff bases; acetylcholinesterase; carbonic anhydrase; enzyme inhibition. © 2018 Deutsche Pharmazeutische Gesellschaft. MeSH terms. Acetylcholinesterase ...,negativ,gov
Das Schiff der Träume [fährt einfach weiter]: Deutsches Theater,https://www.deutschestheater.de/programm/produktionen/das-schiff-der-traeume-faehrt-einfach-weiter,"Eine bourgeoise Trauergemeinschaft macht sich am Vorabend des Ersten Weltkriegs mit dem Luxusdampfer Gloria N. auf, der besten Opernsängerin aller Zeiten die ...",negativ,de
Willkommen bei DEUTSCHE SCHIFFAHRT AG,http://www.schifffahrt.de/,"Die DEUTSCHE SCHIFFAHRT AG vermittelt renditestarke Kapitalanlagen im Schiffahrtsbereich, vornehmlich für institutionelle Anleger. DEUTSCHE SCHIFFAHRT AG ...",negativ,de
unsere Ausflugsfahrten auf der Seine - Bateaux Parisiens,https://www.bateauxparisiens.com/deutsch.html,Deutsch. Français English Español Português Italiano · Restaurant-Fahrten Spazier-Fahrten Bistro Parisien Bateaux Parisiens. Ihre Events. Privatpersonen ...,neutral,com
Russland schickt Schiff: Putin startet Lauschangriff auf deutsche ...,https://www.bild.de/politik/ausland-und-internationales/russland-schickt-schiff-putin-startet-lauschangriff-auf-deutsche-kueste-6675351c6e2b4647e883f308,"Jun 21, 2024 ... Bei der „Wassili Tatischtschew“ handelt es sich laut Kieler Nachrichten um ein Aufklärungsschiff der russischen „Vishnya“-Klasse (Projekt 864), ...",positiv,de
Wie finden deutsche Schifffahrt und Startups besser zusammen?,https://hansa-online.de/2022/06/featured/197374/wie-finden-deutsche-schifffahrt-und-startups-besser-zusammen/,"Jun 22, 2022 ... Zwischen der deutschen maritimen Wirtschaft und der Startup-Branche passt es (noch) nicht so gut. Gründer Carsten Bullemer wünscht sich mehr ...",positiv,de
VDR: Deutsche Schifffahrt bleibt zentraler Pfeiler der Wirtschaft und ...,https://www.schifffahrtundtechnik.de/nachrichten/verkehrspolitik/vdr-ss-3628204,"Mar 11, 2025 ... Im Rahmen der Jahrespressekonferenz am 11. März 2025 blickte der Verband Deutscher Reederei (VDR) auf ein herausforderndes Jahr zurück, in dem ...",neutral,de
DST2025 – Deutscher Schifffahrtstag 2025,https://deutscher-schifffahrtstag.de/,"Der Deutsche Schifffahrtstag · Hintergrund / Historie · Geschichte des DNV ... Schifffahrt - sicher, vernetzt, klimaneutral! Schifffahrt - sicher, vernetzt ...",positiv,de
Home | Deutsche Energy Terminal GmbH,https://energy-terminal.de/,Die Deutsche Energy Terminal GmbH wurde als bundeseigene Gesellschaft für den Betrieb von Terminals zur Anlandung von Flüssigerdgas (LNG) per Schiff gegründet.,negativ,de
AIDA Kreuzfahrten buchen • Schiffsreisen erleben,https://aida.de/,AIDA Welt entdecken ✔️ Kreuzfahrt buchen ✔️ traumhaften Urlaub an Bord unserer Schiffe genießen ✔️ ››› Auf nach AIDA!,positiv,de
Schifffahrt: Deutsche Behörden hindern Öltanker „Eventin“ an ...,https://www.handelsblatt.com/politik/deutschland/schifffahrt-deutsche-behoerden-hindern-oeltanker-eventin-an-weiterfahrt/100100933.html,"Jan 15, 2025 ... Nun fand laut Bundesverkehrsministerium eine Besichtigung der „Eventin“ durch die Klassifikationsgesellschaft Det Norske Veritas (DNV) an Bord ...",negativ,com
Schifffahrtsstandort Deutschland - BMDV,https://bmdv.bund.de/SharedDocs/DE/Artikel/WS/schifffahrtsstandort-deutschland.html,"Ziel des Bundesministeriums für Digitales und Verkehr ist ein starker maritimer Standort mit einer leistungsfähigen Schifffahrt, die ihre Vorteile in der ...",negativ,de
Marine global: Indo-Pacific Deployment 2024 gestartet,https://www.bundeswehr.de/de/organisation/marine/aktuelles/indo-pacific-deployment-2024-beginnt-5780060,"May 8, 2024 ... ... Schifffahrt, die Freiheit der Handelswege“, erläuterte ... Deutsche Luftwaffe und die Deutsche Marine hier gemeinsam mit Partnern üben.",negativ,de
detektor.fm: Wie nachhaltig ist die deutsche Schifffahrt? - Spektrum ...,https://www.spektrum.de/podcast/detektor-fm-wie-nachhaltig-ist-die-deutsche-schifffahrt/2226582,"Jul 31, 2024 ... Um die Schifffahrt nachhaltiger zu gestalten, werden seit Jahren immer nachhaltigere Kraftstoffe verwendet. So werden beispielsweise der ...",negativ,de
Deutsche Offshore Schifffahrt (DO) werden für den Einsatz in ...,https://www.windkraft-journal.de/2025/04/07/deutsche-offshore-schifffahrt-do-werden-fuer-den-einsatz-in-offshore-windparks-mit-modernster-hightech-von-smst-ausgestattet/210203,"Apr 7, 2025 ... ... Deutsche Offshore Schifffahrt (DO) werden mit modernster Hightech von SMST ausgestattet: Der niederländische Marktführer wird sein Gangway ...",neutral,de
10 Longest Words You'll Ever See In German,https://lingopie.com/blog/the-longest-words-in-german/,"May 31, 2024 ... Schiff: ship; Fahrt: travel or journey; Gesellschaft: company or society; Kapitän: captain. Meaning: This word means ""Danube Steamship Company ...",neutral,com
WSA Westdeutsche-Kanaele - Startseite,https://www.wsa-westdeutsche-kanaele.wsv.de/Webs/WSA/Westdeutsche-Kanaele/DE/Startseite/startseite_node.html,Inhalte vom Wasserstraßen- und Schifffahrtsamt Westdeutsche Kanäle · Im Fokus · Aktuelle Meldungen · Unsere Themen · Weitere Angebote · Service ...,neutral,de
"Beethoven: The Piano Sonatas, Volume V - Album by Ludwig van ...",https://open.spotify.com/album/7sK3EbpjZwqnqwMPMwkJIT,"Ludwig van Beethoven, András Schiff. © 2007 ECM Records GmbH, under exclusive license to Deutsche Grammophon GmbH, Berlin. ℗ 2007 ECM Records GmbH, under ...",positiv,com
Deutsche Afrika-Linien,https://www.dal.biz/,DAL Deutsche Afrika-Linien is one of the most highly respected liner shipping companies operating with a focus on Africa.,positiv,biz
Warum kommt es vor Gibraltar zu Orca-Interaktionen mit Segelbooten?,https://www.stiftung-meeresschutz.org/themen/tourismus-schifffahrt/orca-angriffe-auf-segelboote/,"Jul 25, 2024 ... Veröffentlicht unter Artenschutz, Presse, Tourismus - Schifffahrt ... Copyright © 2025 Deutsche Stiftung Meeresschutz Alle Rechte vorbehalten.",neutral,org
Careers at Woodward: Germany,https://www.woodward.com/careers/germany/,"Seit Jahrzehnten entwickeln und fertigen wir hochpräzise Einspritzsysteme für Großdieselmotoren, die in der Energieerzeugung, Schifffahrt und Industrie weltweit ...",negativ,com
Deutsche Gesellschaft für Maritime Medizin e. V.,https://www.thieme-connect.com/products/ejournals/html/10.1055/a-1988-0022,"Liebe Mitglieder der DGMM,. es liegt ein schwieriges Jahr 2022 mit vielfältigen Herausforderungen, denen sich auch die deutsche Schifffahrt stellen musste, ...",negativ,com
Huthi drohen deutschen Reedereien per E-Mail | tagesschau.de,https://www.tagesschau.de/wirtschaft/weltwirtschaft/huthi-rebellen-reedereien-drohung-100.html,Deutsche Schifffahrt Huthi drohen Reedereien per E-Mail. Stand: 18.11.2024 14:12 Uhr. Mehrere deutsche Reedereien haben in den vergangenen Monaten offenbar ...,negativ,de
Deutsche Flüsse 2025/2026 | Jetzt günstig buchen!,https://www.flussreisen.de/flusskreuzfahrten/deutschland/,Lernen Sie die deutschen Städte von einer anderen Seite kennen. Auf Flussreisen deutsche Städte erkunden. Flusskreuzfahrten in Deutschland können mit genau so ...,negativ,de
Panama Papers: Deutsche Schifffahrt - unter fremder Flagge - DER ...,https://www.spiegel.de/wirtschaft/soziales/panama-papers-deutsche-schifffahrt-unter-fremder-flagge-a-1085904.html,"Apr 7, 2016 ... Tatsächlich nutzen viele deutsche Reedereien Briefkastenfirmen zum sogenannten Ausflaggen ihrer Schiffe. Also dazu, die Nationalflagge zu ...",negativ,de
FS Maria S. Merian : Leitstelle Deutsche Forschungsschiffe ...,https://www.ldf.uni-hamburg.de/merian.html,Diese Informationen werden dem Schiff durch die Leitstelle Deutsche Forschungsschiffe rechtzeitig vor Erreichen des jeweils nächsten Abgangshafens mitgeteilt.,negativ,de
