Titel,URL,Beschreibung,Sentiment,Top-Level-Domain
Center-right candidate Friedrich Merz is poised to become ...,https://www.tpr.org/2025-02-23/center-right-candidate-friedrich-merz-is-poised-to-become-germanys-next-chancellor,"Feb 23, 2025 ... After Germans voted on Sunday, the center-right Christian Democrat leader Friedrich Merz is likely to become Germany's next chancellor.",positiv,org
"Germany's early election has produced a new government, with ...",https://m.facebook.com/story.php?story_fbid=1041187854704993&id=100064413655025,"Germany's early election has produced a new government, with Friedrich Merz taking over as chancellor. With a focus on strengthening Europe and reducing...",positiv,com
Friedrich Merz's far-right gamble (Prospect Magazine) - Queen's ...,https://pure.qub.ac.uk/en/clippings/friedrich-merzs-far-right-gamble-prospect-magazine,"Title, Friedrich Merz's far-right gamble (Prospect). Degree of recognition, International. Media name/outlet, Prospect. Media type, Print.",positiv,ac.uk
Friedrich-merz - Page 1 - Investment Week,https://www.investmentweek.co.uk/tag/friedrich-merz,The latest friedrich-merz articles from Investment Week - Page 1.,neutral,co.uk
"Adam Tooze: ""Likely German chancellor Friedrich Merz's fiscal ...",https://bsky.app/profile/adamtooze.bsky.social/post/3lk44vfiu3s2h,"Mar 11, 2025 ... Likely German chancellor Friedrich Merz's fiscal bazooka! The German government could take on just under €2tn in debt over the next decade ...",negativ,app
Tag: Friedrich Merz | The Critic Magazine,https://thecritic.co.uk/tag/friedrich-merz/,"Friedrich Merz. No winners in Germany. No party met their own expectations, but a Grand Coalition might not work this time. Artillery Row.",positiv,co.uk
"The German Election: Friedrich Merz, “Independence” from America ...",https://podcasts.apple.com/us/podcast/the-german-election-friedrich-merz-independence-from/id1685475850?i=1000695576133&l=ar,"This week, Tom and Helen discuss the aftermath of Germany's election, where the Christian Democrats won but with their second-lowest vote tally ever.",positiv,com
Friedrich Merz Archives - The New European,https://www.theneweuropean.co.uk/tag/friedrich-merz/,"Friedrich Merz. The new Bundestag convenes for the first time next week, but it comes with a. Friedrich Merz. Merz faces his next challenge. If Germany's ...",positiv,co.uk
Topic | Friedrich Merz | The Sydney Morning Herald,https://www.smh.com.au/topic/joachim-friedrich-martin-josef-merz-6hd8,"Feb 24, 2025 ... The latest Friedrich Merz news, articles, data, and analysis from The Sydney Morning Herald.",neutral,com.au
1️⃣/3️⃣ Das war #CDULive mit Friedrich Merz!#CDU #Merz ...,https://www.youtube.com/shorts/Qag7NT7r06M,"Nov 29, 2021 ... 1️⃣/3️⃣ Das war #CDULive mit Friedrich Merz!#CDU #Merz #CDUVorsitz. 85. Dislike.",negativ,com
dnoticias.pt — Friedrich Merz,https://www.dnoticias.pt/tag/geral/friedrich-merz/,"Merz avisa que Europa tem de fazer ""muito mais"" pela sua defesa após desvio de Trump. Fechar Partilha. /tag/geral/friedrich-merz/2025/2/24/. A carregar... Não ...",neutral,pt
What does Friedrich Merz's election victory mean for Germany's ...,https://m.youtube.com/watch?v=DrZFye1WFzw&t=1s,"Feb 23, 2025 ... Friedrich Merz sharply criticized Donald Trump's administration and urged Europe to distance from Washington during a post-election panel ...",negativ,com
"""Friedrich Merz"" als eBook kaufen",https://www.thalia.de/shop/home/artikeldetails/A1074078381,"Kaufen Sie ""Friedrich Merz"" von Volker Resing als eBook. ✓ Sofort-Download ✓ eBook verschenken ✓ Thalia Lese-Flat abonnieren.",neutral,de
Liveticker zur Regierungsbildung: BSW reicht Einspruch gegen ...,https://www.faz.net/aktuell/politik/bundestagswahl/liveticker-zur-regierungsbildung-bsw-reicht-einspruch-gegen-bundestagswahlergebnis-ein-faz-110093143.html,Am 6. Mai soll der CDU-Vorsitzende Friedrich Merz vom Bundestag zum Kanzler gewählt werden.,neutral,net
"Liveticker zur Regierungsbildung: SPD wirft der Union vor, die AfD ...",https://www.faz.net/aktuell/politik/bundestagswahl/liveticker-zur-regierungsbildung-hagel-spricht-sich-gegen-steuererhoehungen-aus-faz-110093143.html,Am 6. Mai soll der CDU-Vorsitzende Friedrich Merz vom Bundestag zum Kanzler gewählt werden.,negativ,net
