Titel,URL,Beschreibung,Sentiment,Top-Level-Domain
Carte von dem Hafen und der Stadt Boston - Norman B. Leventhal ...,https://collections.leventhalmap.org/search/commonwealth:3f462w36b,"Carte von dem Hafen und der Stadt Boston. This map is also available in American Revolutionary Geographies Online (ARGO), a collections portal especially built ...",neutral,org
Malawis Staatspräsident Chakwera informiert sich bei OB Schwenke ...,https://www.offenbach.de/buerger_innen/rathaus-politik/politik/oberbuergermeister/meldungen/staatsbesuch-malawi-nachbericht22.08.2024.php,"Aug 22, 2024 ... Am 21. August war der Staatspräsident von Malawi zu Besuch in Offenbach. Er informierte sich bei OB Schwenke über die Hafenentwicklung.",negativ,de
Hafen- und Seemannsamt - Rostock,https://rathaus.rostock.de/de/service/aemter/hafen_und_seemannsamt/251664,"Es ist hierüber täglich rund um die Uhr unmittelbarer Ansprechpartner für die Berufs- und Sportschifffahrt hinsichtlich Liegeplatzvergabe, Verkehrsregelung und ...",negativ,de
Hamburg - § 1 HafenEG | Landesnorm Hamburg | Hafenentwicklung ...,https://www.landesrecht-hamburg.de/bsha/document/jlr-HfEntwGHAV4P1,"Jun 29, 2005 ... § 1. Hafenentwicklung. (1) Dieses Gesetz regelt die Entwicklung des Hamburger Hafens als Universalhafen. ... (3) Das Hafengebiet ist für ...",negativ,de
Hafen und Hof – Gewerbehof – Hafen,https://www.hafenundhof.de/,"Willkommen bei Hafen & Hof · Kontakt. Hafen und Hof Grundbesitz GmbH & Co. KG Zur Alten Flussbadeanstalt 5, 10317 Berlin · Parken vor Ort. Nutzen Sie bitte die ...",negativ,de
OHF Hafen- und Flussbau GmbH: Willkommen,https://www.ohf-wasserbau.de/,"Unser Arbeitsprogramm umfasst den Bereich des Wasserbaus von der Planung bis zur Projektübergabe, von Umbauten bis zu Sanierungs- und Reparaturmaßnahmen. Mehr ...",neutral,de
HIT Germany | Hafen- und Industrietechnik,https://hit-germany.de/,Die HIT bietet innovative und zukunftsorientierte Entwicklungen und Automatisierungen für jede Anforderung der Hafen- und Industrietechnik an. Als Anbieter für ...,negativ,de
Carte von dem Hafen und der Stadt Boston mit den umliegenden ...,https://www.loc.gov/item/gm71005482/,Scale ca. 1:25000. Hand colored to show location of British and American forces. Relief shown by hachures. Depths shown by soundings.,positiv,gov
"Plan von Constantinopel mit den Vorstädten, dem Hafen, und einem ...",https://collections.lib.uwm.edu/digital/collection/agdm/id/1017/,"Plan von Constantinopel mit den Vorstädten, dem Hafen, und einem Theile des Bosporus = Search this record ...",neutral,edu
Hafen- und Kanalrundfahrten,https://www.luebeck-tourismus.de/wasser/auf-dem-wasser/hafen-und-kanalrundfahrten,Hafen- und Kanalrundfahrten in Lübeck. Das Gefühl ist unbeschreiblich. Du gehst an Bord eines sanft schaukelnden Ausflugsschiffes und schon öffnet sich dein ...,neutral,de
Sonntagsshopping am Husumer Hafen und in Schobüll,https://www.husum-tourismus.de/Media/Veranstaltungen/Sonntagsshopping-am-Husumer-Hafen-und-in-Schobuell-Erlebnistag,"Vom 15. März bis 31. Oktober dürfen in Husum die Geschäfte am Hafen (Teilbereiche: Am Außenhafen, Dockkoogstraße, Hafenstraße, Kleikuhle, Schiffbrücke, ...",negativ,de
Taschenbuch Hafen und Umschlag 2025 - BGHW Medienshop,https://www.bghw-medienshop.de/Taschenbuch-Hafen-und-Umschlag,Taschenbuch Hafen und Umschlag 2025 ... Der Jahreskalender richtet sich explizit an Beschäftigte in Hafen und Umschlag und kann z. B. für die individuelle ...,negativ,de
Fortschritte in Hjørring: Hafenentwicklung und festliche Stimmung ...,https://www.daenemark.guide/news/fortschritte-in-hjorring-hafenentwicklung-und-festliche-stimmung-zur-weihnachtszeit/,"Nov 7, 2024 ... Am 1. November 2024 wurde in Hjørring die Weihnachtszeit mit einer festlichen Zeremonie eingeläutet, bei der der große Weihnachtsbaum der Stadt ...",negativ,guide
HIT Hafen- und Industrietechnik GmbH | LinkedIn,https://www.linkedin.com/company/hit-hafen--und-industrietechnik-gmbh,HIT has made a name for itself in automation and drive technology as well as in the field of control systems and electrotechnical installations.,positiv,com
SGV § 119 Hafen- und Ufergeldtarife | RECHT.NRW.DE,https://recht.nrw.de/lmi/owa/br_bes_detail?sg=0&menu=0&bes_id=3766&anw_nr=2&aufgehoben=N&det_id=538012,"(2) Das Hafen- und Ufergeld ist so zu bemessen, dass es zum Umfang und wirtschaftlichen Wert der Inanspruchnahme der Einrichtungen nicht in einem ...",neutral,de
Hafen- und Flughafenärztlicher Dienst​ - Rathaus,https://www.luebeck.de/de/rathaus/verwaltung/gesundheitsamt/infektionsschutz/hygieneueberwachung/flughafen-und-hafenaerztlicher-dienst/index.html,"​Der Hafen- und Flughafenärztliche Dienst hat im Rahmen der Umsetzung von internationalen Gesundheitsvorschriften die Aufgabe, den Eintrag von schweren ...",negativ,de
Hafen und Schifffahrt,https://werksfuehrung.de/en/hafen-und-schifffahrt,Der Hafen und die Schifffahrt schlafen nie! Zahlreiche große und kleine Schiffe fahren über die Elbe und durch die Hafenbecken. Die Containertour: Vom ...,negativ,de
Alfred Ehrhardt & Rolf Tietgens: Hamburger Hafen und ...,https://www.aestiftung.de/ausstellungen/ehrhardt-tietgens/,"In einem unveröffentlichten Werbetext hat Rolf Tietgens sein ästhetisches Konzept beschrieben: „Augenblicke aus der unbeständigen Erscheinungswelt des Hafens, ...",neutral,de
Hotel Hafen Hamburg | Offizielle Website | Bestpreisgarantie,https://www.hotel-hafen-hamburg.de/,Hotel Hafen Hamburg · Ein Sonnenuntergang fotografiert aus der Tower Bar des Hotel Hafen Hamburg mit Blick auf den Hamburger · Ein Hotelgast steht auf dem ...,neutral,de
Rezension zu: M. North: Zwischen Hafen und Horizont | H-Soz-Kult ...,https://www.hsozkult.de/publicationreview/id/reb-24941,"Mar 8, 2019 ... Der Band schließt mit einem Kapitel zu den Gefährdungen der Meere durch intensive Befahrung, durch Tourismus, Überfischung, Rohstoffgewinnung ...",neutral,de
Tarif über Hafen- und Ufergeld der Duisburger Hafen AG und Hafen ...,https://www.duisport.de/wp-content/uploads/2018/07/Tarif-Hafen-und-Ufergeld-01-01-2017.pdf,"1.1. Dieser Tarif gilt für die öffentlichen Häfen der Duisburger Hafen AG und der Hafen Duisburg-Rheinhausen GmbH, nachfolgend einheitlich. DUISPORT genannt.",negativ,de
Detektiv-Trail Hamburg: Hafen und Speicherstadt,https://detektiv-trails.de/produkt/detektiv-trail-hamburg-hafen-und-speicherstadt/,Der Detektiv-Trail ist ein Rätselerlebnis für die ganze Familie. Auf dieser Rätseltour begleitet ihr Detektiv Dachs durch den Hamburger Hafen und die ...,negativ,de
Ansprechpartner Hafen- und Bahnbetriebe | Stadtwerke Koblenz,https://www.stadtwerke-koblenz.de/ueber-uns/ansprechpartner-hafen-und-bahnbetriebe/,UlrichGramsch Ulrich Gramsch. Leiter Hafen- und Bahnbetrieb Leiter Hafen- und Bahnbetrieb. +49 261 98161-016 · gramsch@stadtwerke-koblenz.de.,neutral,de
BayWG: Art. 36 Hafen- und Ländeordnungen - Bürgerservice,https://www.gesetze-bayern.de/Content/Document/BayWG-36,"Eine Beleihung ist nur zulässig, wenn sie im öffentlichen Interesse liegt und die beliehene Person die Gewähr für eine ordnungsgemäße Erfüllung der Aufgaben ...",negativ,de
Profile for Restaurant HAFEN und Ristorante PORTO,https://www.facebook.com/RestaurantHafenRistorantePorto/,Restaurant HAFEN und Ristorante PORTO ... Geniessen Sie unsere traditionellen Speisen im nautischen Ambiente des Restaurant HAFEN oder erfreuen Sie sich an ...,neutral,com
Hafen- und Marktbetriebe | Stadt Frankfurt am Main,https://frankfurt.de/service-und-rathaus/verwaltung/aemter-und-institutionen/hafen--und-marktbetriebe,"Stadtplan ... Schön, dass Sie uns besuchen! Unsere Website verwendet Cookies. Diese kleinen Textdateien gewährleisten die technische Funktionsfähigkeit der ...",negativ,de
Hafen Schaprode: Startseite,https://www.hafen-schaprode.de/,"Viele Einwohner haben ihre Häuser renoviert und bieten Zimmer und Ferienwohnungen zur Vermietung an. Ein wunderschön, direkt am Wasser gelegener Campingplatz ...",neutral,de
„elbsommer“ ist Hafen und Happiness - News - Hafencity,https://www.hafencity.com/news/elbsommer-ist-hafen-und-happiness,"May 27, 2024 ... „elbsommer“ ist Hafen und Happiness ... Der „elbsommer“ ist wieder da: Die beliebte Veranstaltungsreihe der HafenCity Hamburg GmbH startet am 1.",positiv,com
Hafen- und Stadtentwicklung - Port of Switzerland - Schweizerische ...,https://port-of-switzerland.ch/hafenprojekte/hafen-und-stadtentwicklung/,Hafen- und Stadtentwicklung. Die Areale der Schweizerischen Rheinhäfen werden weiterentwickelt und ausgebaut. Dadurch ergeben sich langfristig Möglichkeiten für ...,negativ,ch
10 DM 800 Jahre Hafen und Hamburg (diff.-best.) – MP Edelmetalle,https://www.mp-edelmetalle.de/artikel/silber/4870/silber-10-dm-800-jahre-hafen-und-hamburg-diff-best-----1989-de,"Die letztgeprägte Münze dieser Serie im Jahr 2001, die das 50-jährige Bestehen des Bundesverfassungsgerichts würdigt, markiert den Abschluss einer Ära deutscher ...",negativ,de
PIASTA Tour Guide Hafen und Elbe,https://www.uni-hamburg.de/piasta/welcome-buddy/welcome/piasta-tour-guides-flyer-2022-23/piasta-tour-hafen-elbe.pdf,"Mar 6, 2024 ... Mit deinem. Semesterticket darfst du auch die HVV-Fähren nutzen. Allgemeine INFOS ZUM HAFEN UND ZUR ELBE. PIASTA Tour Guide. Harbor And Elbe.",negativ,de
Stadtgemeinde Neumarkt - Startseite - Stadtleben - Hafen und Boote,https://www.neumarkt.at/Stadtleben/Tourismus_und_Freizeit/Hafen_und_Boote,Hafen und Boote · Bootsplätze - Land und Wasserlieger · Bootsvermietung und Buffet WallerSeeAlm · Fischen und Angelsport · Fischerkartenverkauf in Neumarkt - ...,neutral,at
Frauen am Hafen und auf St. Pauli,https://www.stattreisen-hamburg.de/stadtfuehrungen-und-hafenrundfahrten/thematische-stadtrundgaenge/frauen-am-hafen-und-auf-st-pauli/,"Es geht bei dieser Stadtführung um harte Frauenarbeit in der Fischindustrie, auf Werften und in Reedereien, um Prostitution auf St. Pauli sowie um Wirtinnen wie ...",neutral,de
Kontakt | HFM Frankfurt,https://www.hfm-frankfurt.de/kontakt,"Mangelmeldung. Meldung von Schäden und Mängeln an Gebäuden, Straßen und Anlagen der HFM/ Hafen- und Marktbetriebe mangelmeldung-bau@hfm-frankfurt.de ...",neutral,de
"Abteilung 51/5 - Untere Wasser-, Hafen- und Bodenschutzbehörde ...",https://serviceportal.herne.de/detail/-/vr-bis-detail/einrichtung/21681/show,"Anschrift · Abteilung 51/5 - Untere Wasser-, Hafen- und Bodenschutzbehörde · Technisches Rathaus · Langekampstraße 36 · 44652 Herne · Postfach 10 18 20 ...",neutral,de
Entdecken Sie den Hamburger Hafen und Umgebung!,https://www.hamburg-tourism.de/sehen-erleben/hamburg-maritim/hamburger-hafen-und-umgebung/,Von der Wasserseite aus zeigt sich der Hafen von seiner besten Seite. Zahlreiche Rundfahrten laden täglich zu dieser Entdeckungsreise ein und bieten eine ...,neutral,de
"Bebauungsplan Nr. 109 ""Hafen- und Industriegebiet - Futtermittel ...",https://www.bohmte.de/Umwelt-Bauen-und-Wohnen/Bauleitplanung/Bebauungsplaene/Rechtskraeftige-B-PLan.htm/Seiten/Bebauungsplan-Nr-109-Hafen-und-Industriegebiet-Futtermittel-und-Schuettguthafen.html?,"Bebauungsplan Nr. 109 ""Hafen- und Industriegebiet - Futtermittel- und Schüttguthafen"" ... Um Ihre Wartezeiten für die Bereiche Bürgerbüro, Standesamt und ...",negativ,de
Hafen-und Sportbootmarina Loitz | Startseite,https://www.loitz.de/tourismus/wassertourismus/hafen-und-sportbootmarina-loitz/,"Hafen-und Sportbootmarina Loitz. Die Bundeswasserstraße Peene, ist der einzig schiffbare Fluss in Mecklenburg-Vorpommern. Die Peene bringt Flussidylle und ...",negativ,de
Förderverein Buxtehuder Hafen und Este e.V. – Wir beleben Hafen ...,https://buxtehude-hafen.de/,"Förderverein Buxtehuder Hafen und Este e.V. · Komma an Bord · Estefahrten · Ewer ""Margareta"" · Historisches Bäderboot ""Margarethe"". Unvergessliche Maritime ...",neutral,de
Hafen- und Flughafenärztlicher Dienst,https://www.hamburg.de/politik-und-verwaltung/behoerden/bukea/hu/hygiene-infektionsmedizin/hamburg-port-health-center/hafen-und-flughafenaerztlicher-dienst,Hafen- und Flughafenärztlicher Dienst · Marckmannstraße 129b 20539 Hamburg · +49 40 42845-2202 · +49 40 42845-2209 · E-Mail senden · Webauftritt aufrufen ...,neutral,de
Herausforderungen für den Hafen und die Gebietskörperschaften ...,https://www.adeus.org/dokumente/herausforderungen-fur-den-hafen-und-die-gebietskorperschaften/?lang=de,"Dennoch machen im Bereich der Raumplanung und -entwicklung Programme, Pläne, Vorhaben, Strategien... ... Bilanz des raumordnerischen Orientierungsrahmens ...",negativ,org
Ausblick vom Rainbow-Tower auf Yacht-Hafen und Honolulu ...,https://www.tripadvisor.com/LocationPhotoDirectLink-g60982-d87016-i99662580-Hilton_Hawaiian_Village_Waikiki_Beach_Resort-Honolulu_Oahu_Hawaii.html,"Hilton Hawaiian Village Waikiki Beach Resort, Oahu Picture: Ausblick vom Rainbow-Tower auf Yacht-Hafen und Honolulu - Check out Tripadvisor members' 15396 ...",neutral,com
Hafen- und Krantechnologie - Johannes Hübner Giessen,https://huebner-giessen.com/anwendungen/hafen-und-krantechnologie/,Case Study: RTGs modernisieren und Präzision steigern. Gummibereifte Stapelkrane (RTGs) sind Leistungsträger in jedem Containerterminal… ... Produkte von Hübner ...,neutral,com
Klimatour im Linzer Hafen- und Industriegebiet,https://naturschauspiel.at/naturschauspiele/klimatour-im-linzer-hafen--und-industriegebiet,Hier wird nach der Wanderung unter dem schützenden Dach des Gartenpavillons auch eine Pause mit Verkostung von Spezialitäten aus dem Garten angeboten. Mit der ...,neutral,at
"Ortsgesetz über die Errichtung eines ""sonstigen Sondervermögens ...",https://www.transparenz.bremen.de/metainformationen/ortsgesetz-ueber-die-errichtung-eines-sonstigen-sondervermoegens-hafen-und-flughafen-vom-26-maerz-2002-67680?asl=bremen203_tpgesetz.c.55340.de&template=20_gp_ifg_meta_detail_d,"Mar 26, 2002 ... (1) Die Stadtgemeinde Bremen bildet unter dem Namen „Sonstiges Sondervermögen Hafen der Stadtgemeinde Bremen“ ein nicht rechtsfähiges ...",negativ,de
"Shipspotting: Hamburg. Die Schiffe, der Hafen und die Elbe : Kunadt ...",https://www.amazon.de/Shipspotting-Hamburg-Schiffe-Hafen-Elbe/dp/3938017805,"Shipspotting ist zum Volkshobby geworden. Das Buch für alle, die von Hamburgs Waserseite fasziniert sind, von den Schiffen und vom Hafen. Mit Fotografiertipps ...",negativ,de
Startseite - HAFEN I Laden für schöne Dinge,https://www.hafen-leipzig.de/,"Ob hochwertige Geschenke, schicke Accessoires für deine Wohnung, Musik aus Leipzig und Bücher, oder fein gestaltete Papeterie und Genusswaren: Im Hafen findest ...",neutral,de
"Haustiere, Hafen – und warum Sea World keine Option ist",https://customerfocus.network/andreas-wenk-business-rap/,"Feb 13, 2025 ... Andreas Wenk, CTO beim Tierversicherer Cleos Welt, im Business Rap. 10 knackige Fragen, die Einblicke in sein Leben geben.",negativ,network
Hafen- und Geiseltalseefest - Startseite,https://www.geiseltalsee.de/veranstaltung/hafen-und-geiseltalseefest-1150.html,"Jul 15, 2022 ... Das Hafen- und Geiseltalseefest startet am Freitagabend mit dem beliebten Sommerkino am Geiseltalsee. Ab 20.00 Uhr kann man am Geiseltalsee ...",neutral,de
Klappbrücken zwischen Alter Hafen und Neuer Hafen ...,https://www.bremerhaven.de/de/tourismus/schiffe-haefen/klappbruecken-zwischen-alter-hafen-und-neuer-hafen.36603.html,Die Klappbrücken mit Maschinenhäusern in zeittypischer Klinkerbauweise verbinden den Alten Hafen und den Neuen Hafen miteinander. Eine historische Klappbrücke.,negativ,de
