Titel,URL,Beschreibung,Sentiment,Top-Level-Domain
University of Groningen Legal Challenges for Offshore System ...,https://research.rug.nl/files/573893988/NSE_2020_2022_2.2_Legal_Challenges_for_Offshore_System_Integration_in_Energy_Hubs.pdf,In this fourth phase of the program a particular focus has been placed on the identification of. North Sea Energy Hubs where system integration projects could ...,positiv,nl
Getting high on hydrogen | en:former,https://www.en-former.com/en/getting-high-on-hydrogen/,"Feb 2, 2022 ... Enthusiasm for hydrogen is high, but Agora Energiewende argues ... maritime transport as well as in firming a renewable-based power system.",positiv,com
Energiewende - Erneuerbare Industrien -,https://www.michels.us/de/aqueos-marine-inc/,"Aqueos Marine, Inc. hat es sich zur Aufgabe gemacht, sichere und zuverlässige Lösungen für die Schifffahrt und das Tauchen in den Bereichen Energiewende und ...",negativ,us
Elektrifizierungslösungen für die maritime Energiewende – Siemens ...,https://hansa-online.de/2021/02/sponsoredcontent/169288/elektrifizierungsloesungen-fuer-die-maritime-energiewende-siemens-energy-marine-gestaltet-die-zukunft-der-schifffahrt/,"Feb 1, 2021 ... Elektrifizierungslösungen für die maritime Energiewende – Siemens Energy Marine gestaltet die Zukunft der Schifffahrt ... Um die Zukunftsfähigkeit ...",negativ,de
Reconciling the irreconcilable: what could Germany's next coalition ...,https://www.woodmac.com/reports/coal-reconciling-the-irreconcilable-what-could-germanys-next-coalition-mean-for-the-energiewende-8459/,"Oct 3, 2017 ... Maritime · Oils & Chemicals · Supply Chain ... Reconciling the irreconcilable: what could Germany's next coalition mean for the Energiewende.",neutral,com
Maritime Branche kann Energiewende gestalten und Standort ...,https://nachrichten.idw-online.de/2023/07/27/maritime-branche-kann-energiewende-gestalten-und-standort-deutschland-staerken,"Jul 27, 2023 ... Deutsches Maritimes Zentrum stellt Studie „Maritime Wasserstoffanwender und ihr Anteil am Wasserstoffbedarf Deutschlands“ vor.",neutral,de
Sitemap | The Carbon Trust,https://www.carbontrust.com/de/sitemap,Energiewende · Entkarbonisierung der Wärme · Erneuerbare Energie · Fernwärme ... Maritime Dekarbonisierung · Nachhaltige Kühlung · Offshore-Windenergie · Venture ...,positiv,com
Wissenstransfer für die Energiewende,https://www.hs-bremerhaven.de/en/whats-new/news/2024-new-news/knowledge-transfer-for-the-energy-transition,"Feb 13, 2024 ... Research Cluster Energy and Maritime Technology · Research Cluster ... energy as well as topics relating to the energy transition and political ...",positiv,de
Process Engineering Analysis of Transport Options for Green ...,https://onlinelibrary.wiley.com/doi/10.1002/ente.202301526,"Mar 8, 2024 ... ... Energiewende, Agora Industrie, Hamburg 2023. Google Scholar. 9 L ... 75Methanol for the Maritime Energy Transition, https://www.man-es ...",positiv,com
Curriculum Vitae,https://www.hhh.umn.edu/sites/hhh.umn.edu/files/2023-08/Daniel%20Scholten%20CV%20August%202023.pdf,"the energy routes and pipelines in 21st century maritime Eurasia. • Co-organizer of the 13th Economics of Infrastructures conference,. Delft, 27-28 May 2010 ...",positiv,edu
Expert Perspectives on Norway's Energy Future | About the ...,https://www.chathamhouse.org/2020/06/expert-perspectives-norways-energy-future-0/about-interviewees,"... Energiewende. During his career, Rainer Baake has made a significant ... maritime policy in the Baltic and North Sea. Prior to this, Mr Schellekens ...",positiv,org
Electricity market design in Southeast Asia – Harnessing ...,https://www.youtube.com/watch?v=RorEGY1jjtU,"Nov 2, 2023 ... 1. Ernst Kuneman, Project Manager Power System Transformation Agora Energiewende 2. Sonal Agarwal, Ernst & Young (EY) Singapore 3.",neutral,com
#dekarbonisierung #schifffahrt #energiewende | DNV - Maritime,https://de.linkedin.com/posts/dnv-maritime_dekarbonisierung-schifffahrt-energiewende-activity-7269621722939613184-V_WL,"Dec 3, 2024 ... Beim sechsten Parlamentarischen Abend von DNV und dem Verband Deutscher Reeder (VDR) in Berlin diskutierten über 100 Gäste aus Politik und ...",neutral,com
Sources | Climate Action Tracker,https://climateactiontracker.org/countries/eu/2022-06-03/sources/,"Jun 3, 2022 ... Agora Energiewende. (2022). Regaining Europeʼs Energy Sovereignty ... maritime transport and amending Directive 2009/16/EC. Retrieved ...",positiv,org
distributed energy resources Archives - Oxford Institute for Energy ...,https://www.oxfordenergy.org/tag/distributed-energy-resources/,Marine fuel; Marine transport; Maritime transport; market; Market Analysis; Market Conditions; market constraints; market coupling; market design; Market ...,positiv,org
WORKING PAPER Enabling community energy planning ...,https://sei.info.yorku.ca/files/2020/01/Community-Energy-Planning-paper-January-15-2020-for-Posting-1-1.pdf?x60126,"Jan 8, 2020 ... community-based energy was too expensive, the province shifted its focus to the Maritime Link with Newfoundland and Labrador, claiming this ...",positiv,ca
Daniel Boie - Senior Project Manager - Modern Energy ...,https://th.linkedin.com/in/daniel-boie-737aa9108,PMP Certified Senior Project Manager at Modern Energy Management · ประสบการณ์: Modern Energy Management · การศึกษา: University of Wisconsin-Stout · สถานที่ตั้ง: ...,positiv,com
Der große Umbau - Ist die Energiewende noch zu retten?,https://www.zdf.de/video/magazine/nano-722/221110-sendung-spezial-der-grosse-umbau-energiewende-nano-100,"Niemand kann voraussehen, wie die maritime Tier- und Pflanzenwelt darauf reagieren wird. Dabei sind die Meere die wichtigste Versicherung für ein stabiles ...",negativ,de
