Titel,URL,Beschreibung,Sentiment,Top-Level-Domain
Energy Transition Outlook,https://www.dnv.com/energy-transition-outlook/,Our latest report on the future of energy: Energy Transition Outlook 2024. Download your copy. Maritime Forecast 2024 edition. New Maritime Forecast to 2050.,positiv,com
Home MAN Energy Solutions,https://www.man-es.com/,"Addressing tomorrow's challenges within the marine, energy and industrial sectors, MAN Energy Solutions improves efficiency and performance at a systemic ...",positiv,com
Download our Energy Transition Outlook 2024,https://www.dnv.com/energy-transition-outlook/download/,Maritime equipment and materials · Oil and gas structures and components · Power ... How is heightened focus on energy security impacting the shift to renewable ...,positiv,com
Small monster waves with a big ... - BMWK Newsletter Energiewende,https://www.bmwk-energiewende.de/EWD/Redaktion/EN/Newsletter/2017/16/Meldung/martech.html,"Nov 10, 2017 ... Logo der Energiewende Direkt ... They aim to use maritime energy installations to generate electricity reliably from wave motion and tidal ...",positiv,de
Green methanol best candidate to make shipping climate-neutral ...,https://www.cleanenergywire.org/news/green-methanol-best-candidate-make-shipping-climate-neutral-report,"Apr 7, 2025 ... Clean Energy Wire. Climate-neutral industrial alcohol made with renewable electricity appears to be the most suitable synthetic fuel to ...",positiv,org
Energy Transition Partnership - European Commission,https://maritime-forum.ec.europa.eu/theme/blue-economy-and-fisheries/blue-energy/energy-transition-partnership_en,An overview of initiatives for the energy transition of fishing and aquaculture vessels. ... 16 January 2025. Call for Proposals - Maritime Decarbonisation: Ports ...,positiv,eu
Offshore wind power generation could require use of up to one ...,https://www.cleanenergywire.org/news/offshore-wind-power-generation-could-require-use-one-quarter-germanys-maritime-zone,"Mar 13, 2024 ... “The energy transition changes the use of the sea in a way that's never been seen before,” said BSH head Helge Heegewaldt. However, offshore ...",positiv,org
Maritime Link | Hitachi Energy,https://www.hitachienergy.com/at/de/news-and-events/customer-success-stories/maritime-link,"The Maritime Link Project is a 500 MW high-voltage direct current (HVDC) connection that enables clean, renewable electricity generated in Newfoundland and ...",positiv,com
TES H2: world's leading e-NG producer,https://tes-h2.com/,Hydrogen to Methane – This Company Wants to Transport Clean Energy by Ship ... Zodiac Maritime. We work with. Adnoc Logo. Adnoc. We are partnering with ADNOC ...,positiv,com
SCOR backs TOWT's shipping project to support the energy ...,https://www.reinsurancene.ws/scor-backs-towts-shipping-project-to-support-the-energy-transition/,"Apr 15, 2025 ... SCOR's large corporate risk insurance arm, SCOR Business Solutions, is supporting a new maritime transport project by TransOceanic Wind ...",positiv,ws
Shaping the decarbonisation of marine and energy,https://www.wartsila.com/about/decarbonisation,Shaping the decarbonisation of marine and energy. Wärtsilä accelerates the transition towards marine decarbonisation and the shift to a 100% renewable energy ...,positiv,com
SPECIAL REPORT | Why shipping pure hydrogen around the world ...,https://www.rechargenews.com/energy-transition/special-report-why-shipping-pure-hydrogen-around-the-world-might-already-be-dead-in-the-water/2-1-1155434,"Jan 27, 2022 ... When being transported in giant metal tanks, what really matters is its energy density by volume. “Hydrogen transport by ship is technically ...",positiv,com
Energy in the North Sea,https://www.siemens-energy.com/global/en/home/stories/the-north-sea.html,The North Sea has become a hotspot for green innovation and a blueprint for decarbonization in many other parts of the world.,positiv,com
Energy | Wadden Sea Quality Status Report,https://qsr.waddensea-worldheritage.org/reports/energy,This report gives an overview about the development of energy production in and adjacent to the Wadden Sea and describes major impacts.,positiv,org
Shipping's Energy Transition: Strategic Opportunities in Indonesia ...,https://www.u-mas.co.uk/wp-content/uploads/2022/08/UMAS-GMF-2022-Shippings-Energy-Transition_Strategic-Opportunities-in-Indonesia.pdf,"The Getting to Zero (GtZ) Coalition, a partnership between the Global Maritime. Forum and World Economic Forum, is a community of ambitious stakeholders from.",positiv,co.uk
The road to zero emission shipbuilding Industry: A systematic and ...,https://www.sciencedirect.com/science/article/pii/S2590174523000211,"Shipyards can act as an energy hub in the maritime industry, providing renewable energy and alternative fuels. Abstract. The International Maritime Organisation ...",positiv,com
MAN Energy Solutions - Wikipedia,https://en.wikipedia.org/wiki/MAN_Energy_Solutions,MAN Energy Solutions SE (Societas Europaea) is a German manufacturer of large diesel engines and turbomachinery for maritime and stationary applications ...,positiv,org
Green Energy's Rope-a-Dope,https://maritime-executive.com/magazine/green-energy-s-rope-a-dope,"Apr 10, 2024 ... Germany's energy transition – Energiewende – has been ... The Maritime Executive's Annual Offshore Energy Edition is Available Online ...",positiv,com
Geopolitics of the Energy Transformation: The Hydrogen Factor,https://www.irena.org/-/media/Files/IRENA/Agency/Publication/2022/Jan/IRENA_Geopolitics_Hydrogen_2022.pdf,"Jan 19, 2022 ... It could also be used as a decarbonisation fuel, such as in the shipping industry and power generation. The downside is that ammonia is toxic if ...",neutral,org
Communication from the Commission: On the Energy Transition of ...,https://oceans-and-fisheries.ec.europa.eu/publications/communication-commission-energy-transition-eu-fisheries-and-aquaculture-sector_en,"Feb 21, 2023 ... Oceans and fisheries. This site is managed by: Directorate-General for Maritime Affairs and Fisheries. Accessibility. Contact us. Contacts and ...",positiv,eu
Making the most of offshore wind,https://www.agora-energiewende.org/publications/making-the-most-of-offshore-wind,"Mar 3, 2020 ... ... energy transition, also known as the German “Energiewende”. ... Offshore wind energy clusters in the German North Sea. Figure 4 from ...",positiv,org
Media Partnership - Harnessing the Wind: The Future of Offshore ...,https://events.euractiv.com/event/info/media-partnership-harnessing-the-wind-the-future-of-offshore-energy-in-the-baltic-sea,"Mar 18, 2025 ... Harnessing the Wind: The Future of Offshore Energy in the Baltic Sea Empowering Europe for a Sustainable and Secure Future ...",positiv,com
Combined Exploitation of Offshore Wind and Wave Energy in the ...,https://www.frontiersin.org/journals/energy-research/articles/10.3389/fenrg.2019.00042/full,"Apr 23, 2019 ... ... energy power supply (Ocean Energy Systems, 2017). Among the different developed marine renewable technologies, marine wind energy is the ...",positiv,org
Sail Norway's fjords in good conscience – on the zero-emission ...,https://energytransition.org/2018/10/norways-fjords-zero-emission-future/,"Oct 4, 2018 ... Also, by 2025 new ships should be (it's all nonbinding, mind you) 30% more energy efficient than those built in 2014. Shipping is one component ...",positiv,org
Maritime,https://www.dvvmedia-shop.de/en/Maritime/,"Ship news - Magazines for the maritime market Maritime news at the pulse ... maritime Energiewende. Der Name ist neu, das Konzept bleibt bewährt: Wir ...",neutral,de
In Defense of the Energiewende,https://www.csis.org/analysis/defense-energiewende,"Aug 24, 2020 ... Asia Maritime Transparency Initiative · Asia Program · Australia Chair ... The overall tone is failure—driven by two observations: First, the ...",negativ,org
Homepage - BMWK,https://www.bmwk.de/Navigation/EN/Home/home.html,"Maritime Industry. Energy. The Energy Transition · Renewable Energy · Grids ... Newsletter ""Energiewende direkt"". Ministry. Minister · State Secretaries · Tasks ...",positiv,de
Net Zero Roadmap: A Global Pathway to Keep the 1.5 °C Goal in ...,https://www.iea.org/reports/net-zero-roadmap-a-global-pathway-to-keep-the-15-0c-goal-in-reach,"Sep 26, 2023 ... ... energy crisis triggered by Russia's invasion of Ukraine in February 2022. And energy sector carbon dioxide emissions have continued to rise ...",negativ,org
Topic: Energy security - NATO,https://www.nato.int/cps/en/natohq/topics_49208.htm,"Jan 11, 2024 ... They agreed to establish NATO's Maritime Centre for the Security of Critical Undersea Infrastructure within NATO's Maritime Command (MARCOM).",positiv,int
New Energy Outlook 2025 | BloombergNEF | Bloomberg Finance LP,https://about.bnef.com/new-energy-outlook/,"... energy efficiency. In power and transport, it assumes that the future fuel mix does not evolve from 2023 (2027 in shipping). 'Clean power' includes ...",positiv,com
Innovation Fund projects - European Commission,https://climate.ec.europa.eu/eu-action/eu-funding-climate-action/innovation-fund/innovation-fund-projects_en,"Renewable energy, Wind energy, Spain, Reducing fuel consumption in maritime transport through wind energy. Grant signed. GeoHuberila: An innovative heating and ...",positiv,eu
B9 Energy Storage project: 'NI/GB Green Shipping Corridor' funded ...,https://www.energyireland.ie/b9-energy-storage-project-ni-gb-green-shipping-corridor-funded-by-iuk-dft-cmdc-r4-strand-3/,"May 29, 2024 ... The main innovation in the project is to capture CO2 from the onboard reformer and return it to the methanol synthesis plant in the same tank ...",positiv,ie
CMBlu Energy | LinkedIn,https://www.linkedin.com/company/cmblu-energy-ag,"Nov 23, 2023 ... ... energy demand ⚡️ Transmission and distribution Micro- and off-grids ⛴ Maritime energy supply CMBlu is located in Alzenau, near ...",positiv,com
Offshore Wind Energy is Booming in Europe - Yale e360,https://e360.yale.edu/features/european_offshore_wind_industry_booming,"Oct 20, 2016 ... As Europe's wind energy production rises dramatically, offshore turbines are proliferating from the Irish Sea to the Baltic Sea.",positiv,edu
8. GSK-Hafenforum: Die maritime Energiewende,https://gsk.de/de/gsk-hafenforum-die-maritime-energiewende/,"Sep 28, 2023 ... 8. GSK-Hafenforum: Die maritime Energiewende. Für unser 8. GSK-Hafenforum am 21. September 2023 im Hamburger Hafen-Club konnte Dr. Arne ...",negativ,de
MAN Energy Solutions Wins Order for Battery-Hybrid Dual-Fuel ...,https://man-es.com/docs/default-source/press-releases-new/20190604_man_es_pr-seaspan_first-two-battery-hybrid-installations_en.pdf?sfvrsn=24dc9c31_2,"Jun 4, 2019 ... AKA specialises in power supply, energy management and drive systems for marine and industrial applications. Similarly, MAN Energy Solutions' ...",positiv,com
LGP-Fuelled ME-LGIP To Power Chinese VLGC,https://www.marinelink.com/news/lgpfuelled-melgip-power-chinese-vlgc-462362,"Jan 31, 2019 ... The Maritime Energy Transition The development of the ME-LGIP engine ... The term stems from the German expression 'Energiewende' and encapsulates ...",positiv,com
Possibilities and examples for energy transition of fishing and ...,https://op.europa.eu/en/publication-detail/-/publication/23464c13-b1c0-11ed-8912-01aa75ed71a1,"Feb 21, 2023 ... ... Maritime Affairs and Fisheries (European Commission); Themes: Energy , Fisheries policy; Subject: aquaculture , energy technology , energy ...",positiv,eu
The Future Cost of Electricity-Based Synthetic Fuels,https://www.agora-energiewende.de/fileadmin/Projekte/2017/SynKost_2050/Agora_SynKost_Study_EN_WEB.pdf,"Nov 29, 2017 ... Maritime Journal (2017): Energy Efficient Hybrids for. Rijkswaterstaat www.maritimejournal.com/news101/vessel-build- · and-maintenance/ship-and ...",positiv,de
News - en,https://www.orcan-energy.com/en/news/category/press-reports.html,"Orcan Energy launches particularly powerful marine waste heat solution for more sustainability in shipping ... Munich, 26.04.2022 - Leading waste heat company ...",positiv,com
News - en,https://www.orcan-energy.com/en/news/category/press-reports.html,"Orcan Energy launches particularly powerful marine waste heat solution for more sustainability in shipping ... Munich, 26.04.2022 - Leading waste heat company ...",positiv,com
Monitoring Energy Policy | SpringerLink,https://link.springer.com/10.1007/978-3-030-43250-8_43,"Sep 22, 2022 ... ... Maritime Organization (IMO) has prioritized improved monitoring of ship fuel use as part of a three-step approach, moving from data ...",positiv,com
Insight Offshore Wind Energy,https://www.meere-online.de/en/topics/human-use-of-the-ocean/insight-offshore-wind-energy,"Energy from renewable sources is becoming increasingly important, including at sea, for example, through offshore wind farms. However, fossil deposits in the ...",positiv,de
Ocean energy about to ride a wave – DW – 02/09/2021,https://www.dw.com/en/ocean-energy-about-to-ride-a-wave/a-56316422,"Feb 9, 2021 ... The long road to harnessing marine power. Bringing a renewable energy source like ocean energy to market has, as with wind and solar, demanded ...",positiv,com
Energy transition in EU Fisheries and Aquaculture sectors,https://ec.europa.eu/commission/presscorner/detail/en/qanda_23_829,"Feb 20, 2023 ... In 2022, marine-diesel prices more than doubled compared to the average prices in 2021, which led to energy costs increasing from 13% of ...",positiv,eu
Covering Germany's green hydrogen demand: Transport options for ...,https://guidehouse.com/-/media/www/site/insights/energy/2022/transport-options-for-covering-germanys-green-hydrogen-demand.pdf,"This requires pipeline compressors to be operated using electricity with high renewable energy shares in all transit countries. For shipping, decarbonized fuels ...",positiv,com
Shipping's Energy Transition:,https://oceanjusticeinitiative.org/main/wp-content/uploads/2022/08/Shippings-Energy-Transition_Strategic-Opportunities-in-Indonesia.pdf,"But for the particular case of diesel – where heavy fuel oil (HFO) and marine diesel oil (MDO) are located – and gas, the Indonesian GHG inventory cannot.",positiv,org
Energy Transition Partnership for fisheries and Aquaculture ...,https://westmed-initiative.ec.europa.eu/events/energy-transition-partnership-for-fisheries-and-aquaculture-workshop-on-skills-19-april-2024-hybrid/,"Apr 19, 2024 ... Common Maritime Agenda for the Black Sea. Menu Menu. You are here ... You are here: Home1 / Events3 / Energy Transition Partnership for fisheries ...",positiv,eu
NORTH SEA ENERGY OUTLOOK (NEO),https://www.government.nl/binaries/government/documenten/reports/2020/09/01/report-north-sea-energy-outlook/Noordzee+Energie+Outlook_09-2020_UK.pdf,"Sep 1, 2020 ... The energy transition therefore offers plenty of economic opportunities for the Netherlands in the North Sea. November 2020. E. P. Nas, LLM.",positiv,nl
Analysis of Influencing Factors of the Energy Transition Process in ...,https://www.mdpi.com/2071-1050/16/4/1416,"According to the International Maritime Organization, the shipping industry contributes to 3.3% of global CO2 emissions. Reducing carbon emissions by 50% ...",positiv,com
Schifffahrt: Wie die maritime Energiewende für Containerschiffe ...,https://www.manager-magazin.de/unternehmen/industrie/containerschifffahrt-wie-die-maritime-energiewende-gelingen-soll-a-9809c199-ac0e-4d23-a0c7-f7de6defd8c0,"Jan 12, 2023 ... Maritime Energiewende Wie Ozeanriesen klimafreundlicher werden sollen. Containerschiffe sind das wichtigste und effizienteste Transportmittel ...",negativ,de
Advanced power plant flexibility | Clean Energy Ministerial,https://www.cleanenergyministerial.org/initiatives-campaigns/advanced-power-plant-flexibility/,Clean Energy Marine HubsFacilitate clean energy transformation through Maritime ... VGB Powertech Agora energiewende. Electricité de France (EDF). Contact us.,positiv,org
The Year Ahead in Environment and Energy | Wilson Center,https://www.wilsoncenter.org/event/the-year-ahead-environment-and-energy-2,"Feb 11, 2016 ... How do you build on efforts to prepare vulnerable countries for things like rising sea levels?” Climate change has been largely absent from ...",positiv,org
Press release: Maintain long-term expansion target of 70 GW of ...,https://bwo-offshorewind.de/en/pressemeldung-langfristiges-ausbauziel-von-70-gw-offshore-wind-beibehalten-fuer-eine-sichere-bezahlbare-und-europaeisch-gedachte-energiewende/,"Mar 24, 2025 ... Wind energy at sea supplies clean electricity for a sustainable Germany and is already a mainstay of the energy transition. They are ...",positiv,de
Beyond Autarky: Discourses of Islandness-As-Heritage in Islands ...,https://islandstudiesjournal.org/article/87733-beyond-autarky-discourses-of-islandness-as-heritage-in-islands-energy-transitions,"Nov 1, 2023 ... ... maritime interconnectedness and discusses its potential relevance to energy transition processes. ... Energiewende Magazin. http:/​/​ews ...",positiv,org
Summary of Inflation Reduction Act provisions related to renewable ...,https://www.epa.gov/green-power-markets/summary-inflation-reduction-act-provisions-related-renewable-energy,"biomass, landfill gas, hydroelectric, marine and hydrokinetic. Through at ... Clean Energy Production Tax Credit and Clean Energy Investment Tax Credit.",positiv,gov
LIQUID HYDROGEN MASS STORAGE TANKS PRESSURE ...,https://www.elizabethqueenseaswann.com/Boat_Development_Specifications/Liquid_Hydrogen_Cylinders_Mass_Storage_Ships_Hull_Calculations4000Nautical_Miles_Range.html,... shipping industry. The term 'Maritime Energy Transition' stems from the German expression 'Energiewende' and encapsulates MAN Energy Solutions' call to ...,positiv,com
Energy Technology Perspectives 2020,https://iea.blob.core.windows.net/assets/7f8aed40-89af-4348-be19-c8a67df0b9ea/Energy_Technology_Perspectives_2020_PDF.pdf,"... maritime shipping by vessel type and fuel, 2019..................... 274. Global CO2 emissions reductions in shipping by mitigation category (left) and ...",positiv,net
PtX Hub: Start,https://ptx-hub.org/,... maritime fuels in Morocco and are supporting the development and ... Becoming a green hydrogen hub and expanding power generation with renewable energy.,positiv,org
Wind and water to ammonia – marine fuel and energy ... - Campfire,https://wir-campfire.de/en/home-02-en/,The goal of the consortium is to research and develop new energy conversion and storage technologies based on green ammonia for the energy system of the future.,positiv,de
Wind and water to ammonia – marine fuel and energy ... - Campfire,https://wir-campfire.de/en/home-02-en/,The goal of the consortium is to research and develop new energy conversion and storage technologies based on green ammonia for the energy system of the future.,positiv,de
About Us | Buss Energy Group,https://www.buss-energy.com/en/about-us/,Buss Energy Group provides technical services in the field of wind energy and logistics. ... maritime logistics. Read more. Wind Energy. The Buss Terminal in ...,positiv,com
RENEWABLES 2021 GLOBAL STATUS REPORT,https://www.ren21.net/wp-content/uploads/2019/05/GSR2021_Full_Report.pdf,"... energy for their transport needs mainly from biofuels, renewables-based electricity, and renewable hydrogen across the road, rail, maritime and aviation.",positiv,net
Overview of the Development of Low/Zero-Emission Marine Fuels ...,http://www.nrdc.cn/Public/uploads/2022-11-04/6364d31ee145d.pdf,"Nov 4, 2022 ... These factors place China in an advantageous position to propel the shipping sector's energy transition through: developing emissions-free ...",positiv,cn
"Samorka, Ministry of Industries and Innovation, Associated Icelandic ...",https://samorka.is/wp-content/uploads/2021/12/Decarbonization-IMS_Final-Rev2.pdf,"Dec 7, 2021 ... ... energy for use in the maritime sector. Iceland's target of achieving carbon neutrality by 2040 and becoming independent from fossil fuels by ...",positiv,is
"""Hydrogen-Ready"" LNG Infrastructure: An Uncertain Way Forward",https://www.nrdc.org/bio/ade-samuel/hydrogen-ready-lng-infrastructure-uncertain-way-forward,"Feb 14, 2023 ... This adds cost and energy intensity to the shipping process. Given ... For example, the think tank Agora Energiewende calculates that ...",positiv,org
CAPTN Energy: Förderung innovativer Lösungen für die maritime ...,https://clean-energy-valley.de/projekte/captn-energy-in-kiel,"CAPTN Energy: Förderung innovativer Lösungen für die maritime Energiewende. CAPTN Energy fördert Forschungs- und Entwicklungsprojekte, die Produkte und ...",negativ,de
Rostocker Forscher gestalten maritime Energiewende - Fakultät für ...,https://www.msf.uni-rostock.de/vorlage-aktuelles/detailansicht-der-news/n/rostocker-forscher-gestalten-maritime-energiewende-1/,"Rostocker Forscher gestalten maritime Energiewende. 23.06.2021. v.l.: Die drei experimentell arbeitenden Motorenforscher Karsten Schleef, Sebastian Cepelak, ...",negativ,de
Sustainable Hydrogen Fuels versus Fossil Fuels for Trucking ...,https://ceepr.mit.edu/wp-content/uploads/2022/07/2022-010.pdf,"Jul 1, 2022 ... with reference to renewable energy production (electricity and SHF), distribution (tank ship, tank truck, storage, fuel station) and the use ...",positiv,edu
Energy Insights 2024 | Baker Institute,https://www.bakerinstitute.org/energy-insights-2024,"Aug 19, 2024 ... ... Energy, Maritime Security, and Beyond?,” Naval War College Review 75, no. 4 (Autumn 2022): 1–36, https://digital-commons.usnwc.edu/nwc ...",negativ,org
Energy security in the Baltic Sea Region Transition within ...,https://pure.diis.dk/ws/files/10998512/Energy_security_in_the_Baltic_Sea_Region_DIIS_Report_2022_08.pdf,"Aug 22, 2022 ... Baltic Energy Market Interconnection Plan. BRELL. Belarus, Russia, Estonia, Latvia and Lithuania. BSR. Baltic Sea Region. CEE.",positiv,dk
Energy prosumers and cities — European Environment Agency,https://www.eea.europa.eu/publications/energy-prosumers-and-cities,"Oct 28, 2022 ... WISE marine - Marine information system for Europe · WISE freshwater ... Agora Energiewende, 2019, European energy transition 2030: the ...",positiv,eu
Process Engineering Analysis of Transport Options for Green ...,https://www.dvgw.de/medien/dvgw/verein/energiewende/energy-tech-2024-staudt-transport-options-for-green-hydrogen.pdf,"Feb 19, 2024 ... Energy requirements for each step of the process chain (conversion in export country, storage and loading, shipping, and reconversion in import.",positiv,de
Maritime Wirtschaft - Herausforderungen und Chancen durch die ...,https://www.ihk-nord.de/produktmarken/schwerpunkte/maritime-wirtschaft-infrastruktur-seeverkehr/nmk-2023-5912922,Die maritime Branche steht nach der Corona-Pandemie insbesondere im Hinblick auf die Energiewende und die Transformation zu einer klimaneutralen Wirtschaft vor ...,negativ,de
Maritime Energiewende: Strategierat Weser-Ems im Austausch mit ...,https://greenshipping-niedersachsen.de/en/2020/07/08/maritime-energiewende-strategierat-weser-ems-im-austausch-mit-ministerin-birgit-hone/,"Jul 8, 2020 ... Vertreter des Maritimen Strategierates Weser-Ems erörtern aktuelle Herausforderungen und Handlungsbedarfe in Schifffahrt und Schiffbau mit ...",neutral,de
Integrated National Energy and Climate Plan,https://energy.ec.europa.eu/system/files/2020-03/nl_final_necp_main_en_0.pdf,"Mar 9, 2020 ... farms between responsible authorities for energy, maritime spatial planning and environment. Offshore Grids and other Offshore ...",positiv,eu
East Energy: About us,https://east-energy.de/en/,"Among other things, green methanol serves as an alternative fuel for shipping. As there is currently not enough green methanol to meet global demand, our work ...",positiv,de
study on the readiness and availability of low- and zero-carbon ship ...,https://greenvoyage2050.imo.org/wp-content/uploads/2023/08/Readiness-of-Low-Zero-Carbon-Marine-Fuels-Technology-Full-Report-v1.pdf,"The candidate fuels considered in this study included advanced biofuels, e-fuels made from renewable energy, 'blue' fuels with carbon captured and stored (CCS) ...",positiv,org
The role of hydrogen in a net zero energy system,https://raeng.org.uk/media/tkphxfwy/the-role-of-hydrogen-in-the-net-zero-energy-system.pdf,"42 These findings, however, will require further validation in practice. Shipping: Low-carbon fuels are expected to be the major source of abatement for ...",positiv,org.uk
„North Sea Wind Power Hub“- Consortium for a European Energy ...,https://www.erneuerbare-energien-hamburg.de/en/news/details/north-sea-wind-power-hub-konsortium-f%C3%BCr-eine-europ%C3%A4ische-energiewende-2.html,"Mar 23, 2022 ... We initiated the North Sea Wind Power Hub consortium – to trigger the thinking process amongst TSO's and governments.",positiv,de
(PDF) BEYOND TRADITIONAL SECURITY: SOUTH KOREA'S ...,https://www.researchgate.net/publication/350793773_BEYOND_TRADITIONAL_SECURITY_SOUTH_KOREA'S_POSITIONING_TOWARDS_THE_CYBER_ENERGY_MARITIME_AND_TRADE_SECURITY_DOMAINS,"The report analyses non-traditional security by focusing on four key domains: cyber, energy, maritime and trade.",positiv,net
Team Horn | Dr. E. Horn,https://dr-horn.org/en/author/horn/,"Ein wichtiger Fokus wird die maritime Energiewende sein. Read More. Share. January 14, 2025by Team HornMessenews · MSR MEORGA Ludwigshafen, 10.09.25. MEORGA ...",negativ,org
