Titel,URL,Beschreibung,Sentiment,Top-Level-Domain
Handlungsfelder - DMZ | Deutsches Maritimes Zentrum,https://dmz-maritim.de/handlungsfelder/,"Technologischer Wandel – Mit Hightech in die Zukunft. Die Position der deutschen maritimen Branche auf dem Weltmarkt hängt davon ab, dass sie ihr ...",negativ,de
Maritime Agenda 2025 - BMWK,https://www.bmwk.de/Redaktion/DE/Publikationen/Wirtschaft/maritime-agenda-2025.html,"Jan 11, 2017 ... ... Wandel, maritime Sicherheit sowie steigende Anforderungen in den ... maritime Branche geltende Rahmenbedingungen formuliert werden. In ...",neutral,de
Für die maritime Branche - DMZ | Deutsches Maritimes Zentrum,https://dmz-maritim.de/organisation/,"Unsere Handlungsfelder sind: Wettbewerbsfähigkeit, Nachhaltigkeit und Klimawandel, Technologischer Wandel, Demografie und. Nachwuchssicherung. VEREIN. Der ...",negativ,de
Discussion,https://ftp.zew.de/pub/zew-docs/dp/dp9607.pdf,"""Technological Change and Regional Development in Europe"" (Technologischer Wandel und ... branches. This eventually resulted in an integration of the ...",neutral,de
Deutsches Maritimes Zentrum | LinkedIn,https://de.linkedin.com/company/deutsches-maritimes-zentrum,"Technologischer Wandel - Mit Hightech in die Zukunft Wir unterstützen den ... maritime Branche, maritime Start-ups und Schiffsrecycling. Orte. Primär.",negativ,com
Ihre Karriere bei Deutsches Maritimes Zentrum e.V. | StepStone,https://www.stepstone.de/cmp/de/Deutsches-Maritimes-Zentrum-e-V-195712/uber-das-unternehmen.html,"Unsere Handlungsfelder sind: Wettbewerbsfähigkeit, Nachhaltigkeit und Klimawandel, Technologischer Wandel, Demografie und Nachwuchssicherung. Der Zweck des ...",neutral,de
Digitalisierung in der Schifffahrt,https://www.dnv.de/maritime/insights/topics/digitalisierung-in-der-schifffahrt/,"Schiffe werden sicherer, wirtschaftlicher und umweltfreundlicher. Die maritime Branche kann durch die Verknüpfung von Datenströmen aus unterschiedlichen Quellen ...",negativ,de
"Operation and Management of Maritime Systems, Master (M.Sc ...",https://fiw.hs-wismar.de/bereiche/sal/studiengaenge/operation-and-management-of-maritime-systems-master-msc/,"Das Berufsbild und die Tätigkeitsfelder der maritimen Wirtschaft unterliegen, wie alles andere, auch dem Wandel der Zeit. ... maritime Branche – besonders im ...",negativ,de
KIT - Karlsruher Institut für Technologie,https://www.kit.edu/,Karlsruher Institut für Technologie – technische Universität und zugleich nationales Forschungszentrum mit einzigartigen Forschungsinfrastrukturen.,neutral,edu
thyssenkrupp - engineering.tomorrow.together.,https://www.thyssenkrupp.com/,"Eine solche Präsenz bedeutet Verantwortung – und die Chance, positiven Wandel voranzutreiben. ... Für die Haushaltswaren-Branche entwickeln wir innovative ...",negativ,com
Profile for Maritimes Cluster Norddeutschland e. V.,https://www.facebook.com/maritimescluster/,"Mit dem Wettbewerb prämieren wir wegweisende maritime Innovationen, die zur nachhaltigen Transformation der Branche beitragen. ... Wandel in der maritimen ...",negativ,com
Global Automotive Embedded System Market to Grow at 5.7%,https://www.globenewswire.com/news-release/2024/10/21/2965853/0/en/Global-Automotive-Embedded-System-Market-to-Grow-at-5-7-CAGR-Surpassing-USD-9-317-9-million-by-2034-Future-Market-Insights-Inc.html,"Oct 20, 2024 ... Technologischer Fortschritt : Innovationen im Bereich eingebetteter Softwaretechnologien treiben den Wandel der Branche voran und gestalten die ...",negativ,com
Matija Lakic – Technischer Verkäufer – SF-FILTER | LinkedIn,https://ch.linkedin.com/in/matija-lakic-86b48a75,"Berufserfahrung: SF-FILTER · Standort: Schweiz · 46 Kontakte auf LinkedIn. Sehen Sie sich das Profil von Matija Lakic auf LinkedIn, einer professionellen ...",neutral,com
Rückblick - SMM - SMM,https://www.smm-hamburg.de/messe/ueber-smm/review,... Wandel der Branche. Mit über 48.000 Teilnehmenden aus mehr als 100 Ländern ... Im dynamischen globalen Umfeld steht die maritime Branche an vorderster Front der ...,negativ,de
Neue Perspektiven: Maritime Ausbildung auf hoher See,https://www.reederverband.de/en/system/files/publikationen/deutsche_seeschifffahrt/ds_q2-22.pdf,"Dec 31, 2021 ... ständigem Wandel unterzogen ist. Die Wendepunkte der Hamburger ... Schiffahrt in die maritime Branche ein. Vom Trai- nee bis zum ...",negativ,de
Entwicklung der Werftindustrie – Die MV Werften und maritime ...,https://wirtschaft-mv.de/entwicklung-der-werftindustrie-die-mv-werften-und-maritime-unternehmen-in-rostock-im-spannungsfeld-zwischen-herausforderungen-und-chancen/,"Feb 4, 2025 ... Doch der Strukturwandel, globale Marktveränderungen und neue technologische Anforderungen haben die Branche ... Technologischer Wandel: Neue ...",negativ,de
VSM Verbandsnachrichten 53. Ausgabe | vsm,https://www.vsm.de/en/node/7780,... Technischer Wandel durch die Digitalisierung und die Folgen für die maritime Personalwirtschaft“. ... maritime Branche. „Der Schritt in eine gemeinsame ...,negativ,de
Work Spaces: From the Early-Modern Workshop to the Modern Factory,https://www.ieg-ego.eu/en/threads/crossroads/technified-environments/karsten-uhl-work-spaces-from-the-early-modern-workshop-to-the-modern-factory,"May 2, 2016 ... Landes, David S.: Der entfesselte Prometheus: Technologischer Wandel und industrielle Entwicklung in Westeuropa von 1750 bis zur Gegenwart, Köln ...",neutral,eu
Consumer Electronics - Projecter,https://www.projecter.de/branchen/unterhaltungselektronik/,... SEA sowie im Affiliate Marketing. Mit smarten Thermostaten ... Technologischer Wandel. Um in einer Branche mit raschem technologischen Wandel ...,positiv,de
Deutsches Maritimes Zentrum: Thinktank und vier Handlungsfelder ...,https://hamburg-business.com/de/news/deutsches-maritimes-zentrum-thinktank-und-vier-handlungsfelder,"Jun 10, 2021 ... ... maritime Branche zu begeistern“, erklärt Geschäftsführer Claus Brandt. Das DMZ versteht sich dabei als Bindeglied zwischen den maritimen ...",neutral,com
Bundesbericht Forschung und Innovation 2024,https://www.bundesbericht-forschung-innovation.de/files/BMBF_BuFI-2024_Hauptband.pdf,"... maritime Wirtschaft und schifffahrt ... Wandel aktiv zu gestalten,. Staat, Wirtschaft und Gesellschaft nachhaltig zu modernisieren und dafür die Chancen ...",negativ,de
MAN Energy Solutions bringt Verbot fossiler Schiffskraftstoffe ins Spiel,https://www.green-shipping-news.de/man-energy-solutions-ahoy2050/,"Apr 25, 2021 ... Und von technischer Seite sei die maritime Energiewende längst machbar. ... Shipping News – unabhängige Nachrichten über die maritime Branche.",negativ,de
Unsere Marken aus dem Hause Navico Group | Mastervolt .,https://www.mastervolt.de/unsere-marken-aus-dem-hause-advanced-systems-group-emea/,"INNOVATIVE FÜHRUNGSKRÄFTE. Unsere Führungskräfte bauen eine Erfolgskultur auf, die unseren Wandel vorantreibt und das weltweite. Ancor ist mit der Marke Marine ...",neutral,de
Kosch Klink Performance | SEO & SEA für die Finanzbranche,https://koschklinkperformance.de/,Die stetige Veränderung des Nutzerverhaltens und der kontinuierliche Wandel in der Finanzbranche ... technischer und inhaltlicher Optimierung unseres ...,negativ,de
Klassifikation der Wirtschaftszweige 2008 (WZ 2008) - Stand: 20.04 ...,https://www.destatis.de/DE/Methoden/Klassifikationen/Gueter-Wirtschaftsklassifikationen/Downloads/klassifikation-wz-2008-3100100089004-aktuell.pdf?__blob=publicationFile,"Apr 20, 2023 ... Bei Wirtschaftszweigklassifikationen spielen hier ökono- mische Veränderungen und der technologische Wandel eine entscheidende Rolle.",neutral,de
Schutzverpackungsprodukte der Marke SEALED AIR® – Sealed Air,https://www.sealedair.com/de/products/brand/sealed-air,Nach Branche; Nach Bedarf. Alle Lösungen ansehen. Nach Anwendung. Befülllösungen ... Die Nachfrage im Onlinehandel treibt den Wandel voran · Das sich ...,negativ,com
Insurance Banana Skins 2023,https://www.pwc.at/de/publikationen/branchen-und-wirtschaftsstudien/insurance-banana-skins.html,Die fünf größten Sorgen der heimischen Versicherungsbranche. Regulierung; Cyber-Kriminalität; Technologischer Wandel; Klimawandel. Regulierung. Regulierung. Die ...,negativ,at
160 Jahre KLINGER DNA: Technologischer Wandel als Chance,https://www.klinger-international.com/de/news/klinger-dna-technischer-wandel-als-chance,"Feb 24, 2021 ... Die Zeichen der Zeit erkennen, nach vorne schauen und flexibel handeln, um die Branche mit den besten Produkten zu versorgen - so kam ...",negativ,com
Beratung für die Chemie & Pharma Branche - White Label Advisory,https://www.whitelabeladvisory.de/de/branche/chemie-pharma,"Die Chemie- und Pharmabranche sieht sich einer Reihe von Herausforderungen gegenüber, darunter regulatorische Anforderungen, technologischer Wandel, globaler ...",negativ,de
Rheinmetall: Der integrierte internationale Technologiekonzern,https://www.rheinmetall.com/,Rheinmetall ist ein führendes internationales Systemhaus der Verteidigungsindustrie und zugleich Treiber zukunftsweisender Innovationen auf den zivilen ...,neutral,com
"Der Beitrag von Big Data, KI und digitalen Plattformen auf dem Weg ...",https://www.umweltbundesamt.de/sites/default/files/medien/479/publikationen/texte_85-2022_digitalisierung_als_transformationsmotor_fuer_eine_green_economy.pdf,Die Branche Naturschutz deckt sich mit der Branche Monitoring und/oder Beseitigung von ... Wandel der Strukturen ist erforderlich und ist eben nicht allein ...,negativ,de
|Branchenanalyse kunststoffverarbeitende Industrie 2020 ...,https://www.boeckler.de/fpdf/HBS-007691/p_fofoe_WP_186_2020.pdf,"Digitalisierung wird zwar technologisch getrieben, sie ist aber weit mehr als ein rein technologischer Wandel. ... 35 Automobilindustrie – eine Branche im Wandel ...",neutral,de
Digitalisierung Automobilindustrie - Der Wandel ist Realität,https://derekfinke.com/2016/03/25/digitalisierung-automobilbranche-wandel/,"Mar 25, 2016 ... Soziodemografischer und technologischer Wandel. Durch den ... Wandel auf die Automobilbranche zukommen. Doch ein Raunen, geschweige denn ...",negativ,com
Digitalisierung und Luftfahrt: Technologischer Wandel in der ...,https://link.springer.com/book/10.1007/978-3-658-33963-0,MRO Branche · Flugzeuginstandhaltung · Nachhaltigkeit. Search within this book. Search. Table of contents (6 chapters). Front Matter. Pages I-XI. Download ...,neutral,com
Digitale Marketingstrategien für die Technologie- und ...,https://www.eviom.com/projects/branchen/digitale-marketingstrategien-fuer-die-technologie-und-softwarebranche/,Etwa 30% der Positionen bleiben unbesetzt aufgrund des Mangels an qualifiziertem Personal. Rasanter technologischer Wandel. Die Branche muss sich ständig an ...,negativ,com
Branchen - Forvis Mazars - Deutschland,https://www.forvismazars.com/de/de/branchen,"Jeder Markt und jede Branche bringt spezielle Herausforderungen mit sich – wir sind ... Technologischer Wandel, neue Konsumgewohnheiten, das Gebot der ...",neutral,com
Sechster Förderaufruf „Nachhaltige Modernisierung von ...,https://binsmart.de/foerderung-emissionsfreier-emissionsarmer-antriebe-foerderaufruf-veroeffentlicht/,"Für den Fall, dass die Fördermittel für die jeweilige Branche (Güter- bzw. ... Die Binnenschifffahrt im Wandel – Zwischen technischer Machbarkeit und rechtlichen ...",negativ,de
Hafenentwicklungsplan 2040 - Strategische Vision,https://www.hamburg-port-authority.de/fileadmin/user_upload/hep/HEP2040_Strategische_Vision_Teil1.pdf,"Die globale Wirtschaft und die maritime Branche wan- deln sich tiefgreifend ... Digitalisierung, Automatisierung, demografische Entwicklung und Werte- wandel in ...",negativ,de
Disruptive agile Service Management | Vom Kennen zum Können ...,https://blog.itil.org/,"... Wandel. Die digitale Transformation verändert nicht nur Geschäftsmodelle ... Die IT-Branche leidet unter einem akuten Fachkräftemangel, der nicht nur ...",negativ,org
ConVis – Conversion Visionaries,https://www.con-vis.de/,"Wir von ConVis wissen, dass die digitale Welt und somit auch Marketing-Strategien einem kontinuierlichen Wandel unterliegen. ... Branche und bietet Ihnen flexible ...",negativ,de
Pharmaceutical Industry Trends 2025: What The Future Holds ...,https://www.avenga.com/magazine/pharmaceutical-industry-trends/,"Feb 6, 2025 ... The article covers the most innovative pharma industry trends shaping the future for organizations, patients, and investors.",positiv,com
Anmeldung BinSmart: Sechstes Treffen der ...,https://www.binnenhafen.de/anmeldung-binsmart-sechstes-treffen-der-begleitforschungsgruppe-abschlussveranstaltung-autonomsow-ii/,Die Branche · Die Themen · BÖB-Net · Kontakt. Die Binnenschifffahrt im Wandel: Zwischen technischer Machbarkeit und rechtlichen Hürden. 6. Treffen der BinSmart ...,negativ,de
Vergangene Veranstaltungen Maritimes Cluster Norddeutschland e.V.,https://www.maritimes-cluster.de/maritimer-kalender/vergangene-veranstaltungen/,"Die German Superyacht Conference ist eine führende Veranstaltung der Superyacht-Industrie, die Jahr für Jahr 150 Experten aus der Branche nach Hamburg zieht.",negativ,de
Bessere Antriebe für eine Welt im Wandel,https://www.rolls-royce.com/~/media/Files/R/Rolls-Royce/documents/country/deutschland/FINAL%20Broschuere%2020%20Jahre%20Lufo.pdf,"Ohne LuFo wären unsere Standorte nicht das, was sie heute sind: ein Leuchtturm der Branche über. Deutschland hinaus. Was hat unsere Bevölkerung von LuFo?",neutral,com
Die Digitale Transformation im Gesundheits wesen -,https://library.oapen.org/bitstream/id/e49d9c4d-964a-4515-b03a-e898b1541a92/646031.pdf,"branche, der Sprache, die die Branche benötigt und den Erfordernissen, die explizit ... Der technologische Wandel brachte und bringt Nutzen und gleichzeitig ...",negativ,org
Bremen: Spitzenstandort der Luft- und Raumfahrtindustrie | BDLI,https://www.bdli.de/bremen-spitzenstandort-der-luft-und-raumfahrtindustrie,Bereits vor über einem Jahrhundert begannen Bremer Kaufleute ihre Begeisterung für das Maritime auf die Luftfahrt zu übertragen. ... Branche so eine überaus ...,negativ,de
ReFuelEU Aviation & FuelEU Maritime » Flug- & Schiffsverkehr,https://positionen.wienenergie.at/blog/refuel-eu/,"Dec 9, 2021 ... ... Wandel zu schaffen. Schrittweise Erhöhung der Mindestanteile ... technischer Alternativen zu fossilen Brennstoffen in der Branche zurück.",neutral,at
Verlässlichkeit von sicheren hochautomatisierten maritimen ...,https://www.offis.de/fileadmin/content/files/download_tools/datawork/datawork66.pdf,"Jun 26, 2018 ... maritime Branche. EDITORIAL. Page 4. 2. DATAWORK_Juni 2018 für ... digitalen Wandel wichtige Themen, da mit diesen. Technologien adaptive IT ...",neutral,de
Jobs at Volvo Group,https://jobs.volvogroup.com/,"... Branche und an die Gesellschaft. Bei Volvo Trucks teilen wir die Neugierde zu lernen, wir arbeiten mit Leidenschaft und wir nehmen den Wandel an, um an der ...",negativ,com
DEWI-Offshore and Certification Centre (DEWI-OCC) | Nds ...,https://www.umwelt.niedersachsen.de/startseite/themen/energie/niedersachsische_institute/dewi_offshore_and_certification_centre/-97582.html,... technischer Normen teil. Maritime Kompetenz und spezielles Know-how der Windenergiebranche bilden die Grundlage für die technische und wissenschaftliche ...,negativ,de
