Titel,URL,Beschreibung,Sentiment,Top-Level-Domain
Maritime Wirtschaft - BMWK,https://www.bmwk.de/Redaktion/DE/Dossier/maritime-wirtschaft.html,... Wettbewerbsfähigkeit des Wirtschaftsstandortes und die Sicherung von Wachstum und Beschäftigung. ... Die deutsche maritime Branche ist in vielen Bereichen ...,negativ,de
Maritime Wirtschaft - Herausforderungen und Chancen durch die ...,https://www.ihk-nord.de/produktmarken/schwerpunkte/maritime-wirtschaft-infrastruktur-seeverkehr/nmk-2023-5912922,"... Wettbewerbsfähigkeit von ganz Deutschland als Technologie-, Produktions- und Logistikstandort. Sie ist in Deutschland sehr breit aufgestellt, viele ...",negativ,de
Maritime Wirtschaft - BMWK,https://www.bmwk.de/Redaktion/DE/Textsammlungen/Branchenfokus/Industrie/branchenfokus-maritime-wirtschaft.html,"Die maritime Wirtschaft hat eine Schlüsselrolle für Wettbewerbsfähigkeit, Wachstum und Beschäftigung am Wirtschaftsstandort Deutschland. Mit einem ...",negativ,de
Herausforderungen und Chancen durch die Energiewende - IHK ...,https://www.ihk.de/schleswig-holstein/standortpolitik/wirtschaftspolitik/wirtschaftspolitische-positionen/maritime-wirtschaft/positionspapier-13-nationale-maritime-konferenz2-5919172,Die Sicherung der internationalen Wettbewerbsfähigkeit der maritimen Wirtschaft ist eine nationale Aufgabe. Die ... Die maritime Wirtschaft sichert in Deutschland ...,negativ,de
Maritime Landkarte - DMZ | Deutsches Maritimes Zentrum,https://dmz-maritim.de/maritime-landkarte/,Die maritime Branche in Deutschland spielt eine Schlüsselrolle für die Wettbewerbsfähigkeit des gesamten Wirtschaftsstandorts Deutschland. Schätzungen ...,negativ,de
Maritime Technologien der nächsten Generation - Das ...,https://www.ptj.de/lw_resource/datapool/systemfiles/agent/ptjpublications/549275004CD25368E0539A695E86CAEF/live/document/maritime-technologien-der-n-C3-A4chsten-generation_programmbrosch-C3-BCre-bmwi.pdf,"Die maritime Wirtschaft ist von herausragender. Bedeutung für die Wettbewerbsfähigkeit Deutsch- lands als Technologie-, Produktions- und Logistik- standort.",negativ,de
Social Media für die Maritime Branche - DMZ | Deutsches Maritimes ...,https://dmz-maritim.de/social-media-fuer-die-maritime-branche/,"Oct 20, 2021 ... ... Wettbewerbsfähigkeit des maritimen Wirtschaftsstandorts Deutschland zu sichern. Dies gilt auch für die maritimen Akteure, die sich mit dem ...",negativ,de
Maritimes Cluster Norddeutschland,https://www.hamburg.de/politik-und-verwaltung/behoerden/bwi/themen/maritimes-cluster-199524,Förderung von schiffbaulichen Innovationen deutscher Werften zur Verbesserung der Wettbewerbsfähigkeit der maritimen Wirtschaft in Deutschland. Schließen. Was ...,neutral,de
EU-Förderung für maritime Forschung und Entwicklung in ...,https://dmz-maritim.de/eu-foerderung-fuer-maritime-forschung-und-entwicklung-in-deutschland/,"Aug 16, 2021 ... Die maritime Branche in Deutschland nutzt zur nachhaltigen Steigerung von Wettbewerbsfähigkeit und Innovationskraft neben regionalen und ...",negativ,de
11. Nationale Maritime Konferenz in Friedrichshafen: Baden ...,https://www.baden-wuerttemberg.de/de/service/presse/pressemitteilung/pid/11-nationale-maritime-konferenz-in-friedrichshafen,"May 22, 2019 ... Für die auf diesem Gebiet weltweit führende deutsche maritime Industrie liegen hier erhebliche Marktpotenziale.“ Maritimer Wirtschaft stehen ...",negativ,de
Presse: Konferenz Maritime Transformation- DMZ | Deutsches ...,https://dmz-maritim.de/auf-kurs-zukunft-maritime-transformation-wegbereiterin-fuer-die-zukunft/,"Jun 16, 2023 ... Die maritime Branche in ihrer Gesamtheit aus Schiffbau, Zulieferern, Häfen und Schifffahrt ermögliche Deutschland Handel, Produktion und ...",negativ,de
Maritime Wirtschaft - BMDV,https://bmdv.bund.de/SharedDocs/DE/Artikel/WS/maritime-wirtschaft.html,Die Maritime Wirtschaft in Deutschland ist ein Wirtschaftszweig mit hoher gesamtwirtschaftlicher Bedeutung ... Wettbewerbsfähigkeit der deutschen maritimen ...,negativ,de
Offshore-Wind-Strom für einen wettbewerbsfähigen ...,http://www.offshore-stiftung.de/de/13-handlungsempfehlungen-deutschlandweites-wirtschaftswunder-meer,"Mar 5, 2025 ... ... Wettbewerbsfähigkeit und Innovationskraft in Deutschland sein ... maritimen Industrie, der entstehenden Wasserstoffwirtschaft sowie der ...",neutral,de
Personalberatung Maritime Wirtschaft | TOPOS,https://topos-consult.de/branchen/personalberatung-maritime-wirtschaft/,Der maritimen Wirtschaft kommt daher für die Wettbewerbsfähigkeit des Wirtschaftsstandortes Deutschland und für die Sicherung von Wachstum und Beschäftigung ...,negativ,de
Finanzierungsinstrumente in der maritimen Branche,https://henry.baw.de/bitstreams/c06f9085-1b77-4b76-8145-d062290a1349/download,"Sep 14, 2021 ... ... deutsche maritime Branche betrachtet ... Wettbewerbsfähigkeit deutscher Reeder und der Sicherung des maritimen Standorts Deutschland, vgl.",neutral,de
Holger Klindt und Petra Mahnke_Präsentation -Erdbeobachtung ...,https://www.arctic-office.de/fileadmin/user_upload/www.arctic-office.de/Veranstaltungen/Erdbeobachtung_in_der_Arktis/Holger_Klindt_und_Petra_Mahnke_GMT.pdf,Page 3. Zivile Maritime Sicherheitstechnik. ➢ Der NMMT soll die internationale Wettbewerbsfähigkeit der maritimen Branche weiter stärken – durch gezielte.,negativ,de
Maritimes Kompetenzzentrum - PwC,https://www.pwc.de/de/transport-und-logistik/uebersicht-maritime-wirtschaft.html,"„Finanzierung, Dekarbonisierung und Digitalisierung fordern die maritime Wirtschaft ... Daraus resultieren Chancen und Risiken für deutsche Reedereien und andere ...",negativ,de
MCN.Strategie 2020: Wettbewerbsfähigkeit durch Innovation und ...,https://www.dsn-online.de/fileadmin/user_upload/references-pdf/Strategieentwicklung_Maritimes_Cluster_Norddeutschland.pdf,"deutsche maritime Wirtschaft, bspw. im Bereich der Technologien für die Offshore-Windkraft oder für den Meeresbergbau. Besonders der Ausbau der Offshore ...",negativ,de
Stellungnahme VDR,https://www.bundestag.de/resource/blob/1032236/839b1835dc9b724b529af8d75b8a4e04/20-9-419_Stellungnahme_VDR.pdf,"Nov 29, 2024 ... Baustein für die Wettbewerbsfähigkeit des maritimen Standortes Deutschland sowie einer ... kündigt, eine Industriestrategie für die maritime ...",negativ,de
Für Organisationen - maritimerpfadfinder,https://maritimerpfadfinder.de/fuer-organisationen,"Das Deutsche Maritime Zentrum e.V. ist eine unabhängige Einrichtung, die die maritime Branche dabei unterstützt, die Wettbewerbsfähigkeit und ...",negativ,de
Bekanntmachung,https://www.bundesanzeiger.de/pub/publication/U1RaUGygxl7HYjdT2Er/content/U1RaUGygxl7HYjdT2Er/BAnz%20AT%2030.08.2023%20B2.pdf?inline,"Aug 30, 2023 ... Die maritime Wirtschaft hat eine Schlüsselrolle für Wettbewerbsfähigkeit, Wachstum und Beschäftigung am. Wirtschaftsstandort Deutschland. Mit ...",negativ,de
Bremer Reeder in Sorge um deutsche Wettbewerbsfähigkeit,https://hansa-online.de/2019/06/featured/129472/bremer-reeder-in-sorge-um-deutsche-wettbewerbsfaehigkeit/,"Jun 19, 2019 ... ... maritime Wirtschaft mit ihren über 400.000 Beschäftigten und einem Umsatz von rund 50 Mrd. € für den Wirtschaftsstandort Deutschland habe ...",neutral,de
Maritime Technologien - Förderberatung „Forschung und Innovation ...,https://www.foerderinfo.bund.de/foerderinfo/de/foerderung/bund/mobilitaet/maritime-technologien/maritime-technologien_node.html,Maritime Technologien unterstützen die deutsche Wirtschaft bei der Beschaffung von Rohstoffen und Wirtschaftsgütern. ... Wettbewerbsfähigkeit zu sichern.,negativ,de
Deutsches Maritimes Zentrum: Thinktank und vier Handlungsfelder ...,https://hamburg-business.com/de/news/deutsches-maritimes-zentrum-thinktank-und-vier-handlungsfelder,"Jun 10, 2021 ... An der Zukunftsfähigkeit nicht nur von Deutschlands größtem Seehafen, sondern der gesamten deutschen maritimen Branche, arbeitet das Deutsche ...",neutral,com
Presse Maritimes Cluster Norddeutschland e.V.,https://www.maritimes-cluster.de/presse/das-maritime-cluster-norddeutschland-ist-mitglied-im-deutschen-maritimen-zentrum/,"Nov 29, 2018 ... ... Deutsche Maritime Zentrum (DMZ) aufgenommen zu sein. Das DMZ agiert als Bindeglied zwischen Wirtschaft, Wissenschaft und öffentlicher Hand ...",positiv,de
Maritime Wirtschaft in Niedersachsen | Nds. Ministerium für ...,https://www.mw.niedersachsen.de/startseite/wirtschaft/maritime_wirtschaft/maritime-wirtschaft-in-niedersachsen-145541.html,... maritime Wirtschaft in Deutschland gemeinsam voranzubringen. Das Deutsche ... Wettbewerbsfähigkeit und Innovationskraft des gesamten deutschen ...,neutral,de
Bundesverband der Deutschen Industrie e.V.,https://bdi.eu/,Deutschland hat gewählt. Die deutsche Wirtschaft braucht nun rasch eine stabile und handlungsfähige neue Bundesregierung für die großen Aufgaben.,negativ,eu
Maritime Wirtschaft bricht zu neuen Ufern auf | Special | Japan ...,https://www.gtai.de/de/trade/japan/branchen/maritime-wirtschaft-bricht-zu-neuen-ufern-auf-834244,"Apr 29, 2022 ... ... Wettbewerbsfähigkeit seiner maritimen Wirtschaft stärken. Dazu hat die japanische Regierung im Mai 2021 ein neues Gesetz erlassen, das ...",negativ,de
Steuervergünstigung für die Seeschifffahrt durch die ...,https://www.bundesrechnungshof.de/SharedDocs/Downloads/DE/Berichte/2024/tonnagesteuer-volltext.pdf?__blob=publicationFile&v=2,"Jul 23, 2024 ... perspektiven der maritimen Wirtschaft in Deutschland zur Wettbewerbsfähigkeit des Schiff- ... Die deutsche maritime Wirtschaft steht in ...",negativ,de
Deutsches Maritimes Zentrum - YouTube,https://www.youtube.com/channel/UCLikR8hLO3hJZlHWVSBQHaA,"Zweck des Vereins ist es, die Wettbewerbsfähigkeit ... Das Deutsche Maritime Zentrum versteht sich als Bindeglied zwischen Wirtschaft, Wissenschaft und ...",negativ,com
Deutsches Maritimes Zentrum e.V. hiring Projektmanager*in ...,"https://www.glassdoor.com/job-listing/projektmanager-in-maritime-logistikprozesse-w-m-d-deutsches-maritimes-zentrum-e-v-JV_IC2804376_KO0,49_KE50,81.htm?jl=1009643678281",Das Deutsche Maritime Zentrum (DMZ) ist der Thinktank für die deutsche maritime Wirtschaft. ... Wettbewerbsfähigkeit und Innovationskraft des deutschen maritimen ...,negativ,com
Gründung des Deutschen Maritimen Zentrums - www.vhss.de,https://www.vhbs.de/index.php?id=51&tx_news_pi1%5Bnews%5D=160&tx_news_pi1%5Bcontroller%5D=News&tx_news_pi1%5Baction%5D=detail&cHash=c17e45b11c833a2dbdf34d30541ee82a,"Jul 19, 2017 ... ... maritimen Akteure aus Wirtschaft, Wissenschaft und öffentlicher Hand in Deutschland branchen- und länderübergreifend. Als Think-Tank sollen ...",positiv,de
Deutscher Bundestag Drucksache 20/7571 Antrag der Fraktionen ...,https://dserver.bundestag.de/btd/20/075/2007571.pdf,"Jul 4, 2023 ... für die Wettbewerbsfähigkeit der maritimen Wirtschaft. Kompetenzen ... stiegenen Energiekosten belasten die maritime Wirtschaft in Deutschland.",negativ,de
Report: Transformation der energieintensiven Industrie ...,https://ariadneprojekt.de/publikation/report-transformation-der-energieintensiven-industrie/,"Dec 11, 2024 ... Marktpreise (Energie- und Absatzmärkte): Die Wettbewerbsfähigkeit energieintensiver Produktion in Deutschland wird nicht nur durch ...",negativ,de
Förderprogramme - Maritimes - Förderdatenbank,https://www.foerderdatenbank.de/FDB/Content/DE/Foerderprogramm/Bund/BMWi/maritimes-forschungsprogramm.html,"Die maritime Wirtschaft hat eine Schlüsselrolle für Wettbewerbsfähigkeit, Wachstum und Beschäftigung am Wirtschaftsstandort Deutschland. Mit einem ...",negativ,de
EU-Kommission sieht „Rolle für E-Fuels“ im Straßenverkehr,https://www.dvzzero.de/eu-kommission-sieht-rolle-fuer-e-fuels-im-strassenverkehr-2779965,"Feb 6, 2025 ... Aktionspläne für Autobranche, Häfen, maritime Wirtschaft und die Bahn ... Deutsche Wirtschaftsverbände wie die der Industrie (BDI), der ...",negativ,de
FACHLICHES HINTERGRUNDPAPIER NATIONALER ...,https://www.now-gmbh.de/wp-content/uploads/2024/05/Fachliches-Hintergrundpapier-NAPS.pdf,"May 28, 2024 ... parallel dazu auch die Wettbewerbsfähigkeit. Ein ... maritime Wirtschaft auf europäischer Ebene. (Europäische Maritime Industriestrategie).",negativ,de
Wirtschaft - Innovativer Schiffbau in Deutschland wird auch ... - BAFA,https://www.bafa.de/SharedDocs/Kurzmeldungen/DE/Wirtschaft/20240719_isb_neue_richtlinie.html,"Jul 19, 2024 ... Innovativer Schiffbau ist ein zentraler Bestandteil der deutschen maritimen Wirtschaft. Die deutsche maritime Industrie genießt weltweit ...",negativ,de
Ihre Karriere bei Deutsches Maritimes Zentrum e.V. | StepStone,https://www.stepstone.de/cmp/de/Deutsches-Maritimes-Zentrum-e-V-195712/uber-das-unternehmen.html,"Der Zweck des Vereins ist es, die Wettbewerbsfähigkeit ... Das Deutsche Maritime Zentrum versteht sich als Bindeglied zwischen Wirtschaft, Wissenschaft und ...",negativ,de
Port of Hamburg | CMT nimmt Geschäftstätigkeit als gemeinnützige ...,https://www.hafen-hamburg.de/de/presse/news/cmt-nimmt-geschaeftstaetigkeit-als-gemeinnuetzige-gmbh-auf--36714/,"Mar 1, 2020 ... ... maritimen Industriestandortes Deutschland. Zusätzlich wird der Aufgabenbereich um ein breites Dienstleistungsportfolio ergänzt, das die ...",negativ,de
Port of Hamburg | CMT nimmt Geschäftstätigkeit als gemeinnützige ...,https://www.hafen-hamburg.de/de/presse/news/cmt-nimmt-geschaeftstaetigkeit-als-gemeinnuetzige-gmbh-auf--36714/,"Mar 1, 2020 ... ... maritimen Industriestandortes Deutschland. Zusätzlich wird der Aufgabenbereich um ein breites Dienstleistungsportfolio ergänzt, das die ...",negativ,de
"Wege, die Energiekrise zu meistern und Wettbewerbsfähigkeit zu ...",https://www.bdo.de/de-de/insights/bdo-foresight/wege-die-energiekrise-zu-meistern-und-wettbewerbsfaehigkeit-zu-sichern,"Dec 1, 2022 ... Zur Erreichung dieser Ziele stellt das Bundesministerium für Wirtschaft und Klimaschutz unter anderem über das Förderprogramm für „Energie- und ...",negativ,de
Michael Vinnen – DST2025,https://deutscher-schifffahrtstag.de/index.php/2024/08/25/michael-vinnen/,"Aug 25, 2024 ... ... maritime Industrie auch zukünftig ... Der Deutsche Schifffahrtstag 2025 wird beispielhaft die Vielfalt und Attraktivität unserer Branche ...",negativ,de
Offener Brief an das Europäische Parlament und den Rat der EU zu ...,https://www.catf.us/de/resource/open-letter-european-parliament-council-eu-afir-fueleu-maritime-proposals/,"... Maritime Regulation) vor, das die Akzeptanz alternativer Schiffskraftstoffe erhöhen soll. Leider gewährleistet das Gesetz nicht die Wettbewerbsfähigkeit ...",negativ,us
Nachhaltigkeit | Fassmer,https://www.fassmer.de/de/unternehmen/nachhaltigkeit,... maritime Wirtschaft fühlen ... maritimen Industrie und einer erfolgreichen Gestaltung des Standortes Deutschland. Die internationale Wettbewerbsfähigkeit ...,negativ,de
Marinekommando Jahresbericht 2023,https://www.bundeswehr.de/resource/blob/5716058/277a375f7630de85fe86fef391de90b3/jahresbericht-2023-neu--data.pdf,"Sep 11, 2023 ... len Akteure im maritimen Umfeld ist von entscheidender Bedeutung für die Wettbewerbsfähigkeit ... betreut die maritime Wirtschaft und deutsche ...",negativ,de
Die Welt als Arbeitsplatz: Schifffahrt sucht Besatzung der Zukunft ...,https://www.reederverband.de/de/die-welt-als-arbeitsplatz-schifffahrt-sucht-besatzung-der-zukunft,"Sep 13, 2023 ... Doch in den letzten Jahren wurde vermehrt eine wachsende Lücke im Bereich der Fachkräfte in der Schifffahrt und der maritimen Industrie ...",negativ,de
Weiterentwicklung und Neuakzentuierung der Industriepolitik ...,https://www.schleswig-holstein.de/DE/fachinhalte/I/industriepolitik/Downloads/buendnispapier2020.pdf?__blob=publicationFile&v=1,"Feb 17, 2020 ... der Produktivität und Wettbewerbsfähigkeit der Industrie. Die ... Die maritime Industrie prägt auch den Industriestandort Schleswig ...",negativ,de
Deutsche und Niederländer feiern Innovationen für die Schifffahrt ...,https://greenshipping-niedersachsen.de/en/2019/05/23/deutsche-und-niederlaender-feiern-innovationen-fuer-die-schifffahrt/,"May 23, 2019 ... ... maritimen Wirtschaft voranzutreiben und die Wettbewerbsfähigkeit der Branche auszubauen. Insofern sei es auch notwendig, fordert Carl-Ulfert ...",negativ,de
MARIKO | Maritimes Kompetenzzentrum,https://www.mariko-leer.de/,"Als Schnittstelle zwischen der maritimen Wirtschaft, Wissenschaft und der Politik stärken wir die Wettbewerbsfähigkeit und Innovationskraft von Unternehmen und ...",negativ,de
