Titel,URL,Beschreibung,Sentiment,Top-Level-Domain
Ihre Karriere bei Deutsches Maritimes Zentrum e.V. | StepStone,https://www.stepstone.de/cmp/de/Deutsches-Maritimes-Zentrum-e-V-195712/uber-das-unternehmen.html,"... Demografie und Nachwuchssicherung. ... Das Deutsche Maritime Zentrum versteht sich als Bindeglied zwischen Wirtschaft, Wissenschaft und öffentlicher Hand.",0.24695,de
Deutsches Maritimes Zentrum: Thinktank und vier Handlungsfelder ...,https://hamburg-business.com/de/news/deutsches-maritimes-zentrum-thinktank-und-vier-handlungsfelder,"Jun 10, 2021 ... ... maritime Branche zu begeistern“, erklärt Geschäftsführer Claus Brandt. ... Das Deutsche Maritime Zentrum e.V. (DMZ) gegründet Ende 2017 ...",0.1091,com
Weiterentwicklung und Neuakzentuierung der Industriepolitik ...,https://www.schleswig-holstein.de/DE/fachinhalte/I/industriepolitik/Downloads/buendnispapier2020.pdf?__blob=publicationFile&v=1,"Feb 17, 2020 ... 2.4 Maritime Industrie ... holsteinische Industrie nicht so stark wie der Durchschnitt der deutschen Länder.",0.002,de
Deutsche Bahn AG Lagebericht und Jahresabschluss 2014,https://ir.deutschebahn.com/fileadmin/Deutsch/2014/Berichte/2014_Lagebericht_Jahresabschluss_dbag_de-.pdf,der deutschen Industrie ist der DB-Konzern Partner des. Unternehmensnetzwerks ... sicherung zu erweitern sowie das Angebot im Demografie- tarifvertrag ...,0.002,com
Vergangene Veranstaltungen Maritimes Cluster Norddeutschland e.V.,https://www.maritimes-cluster.de/maritimer-kalender/vergangene-veranstaltungen/,Beschäftigung in der maritimen Branche in Deutschland. Vor dem Hintergrund der Fachkräfte- und Nachwuchssicherung hat das Deutsche Maritime Zentrum begonnen ...,0.0,de
Wie sieht die Stadt der Zukunft aus?,https://www.galabau.de/html/epaper/2025-01/epaper/ausgabe.pdf,"Jan 31, 2025 ... Was bedeutet das für die grüne. Branche in Deutschland? Egbert Roozen ... Die Allianz der Grünen. Berufe zur Nachwuchssicherung hat sich ...",-0.45975,de
"SMM - Sie finden uns in Halle A3, Stand 100 - DMZ | Deutsches ...",https://dmz-maritim.de/veranstaltung/smm/,"Demografie und Nachwuchssicherung – Neue Talente für die maritime Branche ... Das Deutsche Maritime Zentrum e.V. ist eine unabhängige Institution, die die ...",-0.4568,de
Handlungsfelder - DMZ | Deutsches Maritimes Zentrum,https://dmz-maritim.de/handlungsfelder/,"... Demografie und Nachwuchssicherung. ... Das Deutsche Maritime Zentrum e.V. ist eine unabhängige Institution, die die maritime Branche unterstützt.",-0.4158,de
Themen und Projekte - DMZ | Deutsches Maritimes Zentrum,https://dmz-maritim.de/themen-und-projekte/,"Nachwuchssicherung · Karina ... Das Deutsche Maritime Zentrum e.V. ist eine unabhängige Institution, die die maritime Branche unterstützt.",-0.4158,de
DB Mobility Logistics Geschäftsbericht 2012,https://www1.deutschebahn.com/resource/blob/1046814/d23276a7df726b7a10a67283b9479eba/2012_gb_dbmlkonzern_de-data.pdf,Ein Meilenstein war in diesem Zusammenhang der Abschluss eines für die Branche neuartigen Demografie-Tarifvertrags im Dezember 2012. Im Zentrum steht eine ...,-0.4158,com
