Titel,URL,Beschreibung,Sentiment,Top-Level-Domain
Miles+Bonus AGB | Aegean Airlines,https://de.aegeanair.com/rechtliche-informationen/milesbonus-terms-and-conditions/,"... branch. Upgrading the card will reward the member with 3,000 tier miles and ... Miles accrual is not valid for shipping cost, cash on delivery, or any other ...",0.7859499999999999,com
FAQ - Cognibox,https://www.cognibox.com/de/faq,"Cognibox ist eine cloudbasierte Softwareplattform für ein effektives Compliance-Management, das den Best Practices der Branche entspricht. Cognibox wird in ...",0.31845,com
Wie wollen wir arbeiten? Berufliches Lernen zwischen Tradition und ...,https://www.pedocs.de/volltexte/2024/30033/pdf/Schloegl_et_al_2022_Wie_wollen_wir.pdf,"chen des Landes (wie Ernährungsindustrie, maritime Wirtschaft, Maschinenbau, Bau- ... dies sichert den Fachkräftebedarf einer Branche (SBFI 2022). Für Unternehmen ...",0.1246,de
AGOMWBW-Rundbrief Nr. 846,https://westpreussen-berlin.de/agom/gemeinsam/AGOM_WBW-Rundbriefe/AWR_20240404_Rundbf-846_AGOMWBW.pdf,"Apr 4, 2024 ... „Requalifizierung“ der ostdeutschen Gesellschaft im Zuge des abrupten ökonomischen ... Branche steigern konnte. Futtermittelzusätze spielten eine ...",0.002,de
60. Nationalkongress des LCGB,https://lcgb.lu/files/2015/01/2020-03-14-Congres-National-Rapport-dActivite-DE-lr.pdf,"Jan 27, 2015 ... ... Branche gerecht zu werden. Heute erlebt der Stahlsektor eine neue ... Treffen mit dem für maritime Angelegen- heiten zuständigen ...",0.002,lu
"The ""1950s Syndrome"" and the Transition from a Slow-Going to a ...",https://www.hist.unibe.ch/e11168/e52524/e69145/e186327/e188603/5_Pfister-1950-syndrome-10_ger.pdf,"international maritime shipping.101. The profound change in the structure of ... Sabel, Das Ende der Massenproduktion: Studie Uber die Requalifizierung der.",-0.8180499999999999,ch
Wege in die digitale Gesellschaft. Computernutzung in der ...,https://zeitgeschichte-digital.de/doks/files/2642/boesch_hg._wege_in_die_digitale_gesellschaft_gesamt_2018_de.pdf,"Teilstreitkräften Luftwaffe, Marine und Heer. Die Folgen zeigen sich ... die Branche zu Beginn der Achtziger.35 Nach dem Zensus 1987 arbeiteten knapp ...",-0.5586,de
Piloten bieten Lufthansa 450 Millionen Euro für Kündigungsschutz ...,https://www.airliners.de/vc-lufthansa-450-millionen-euro-kuendigungsschutz-2022/58192,"Nov 11, 2020 ... ... Requalifizierung eines Großteils des sich in Kurzarbeit befindenden Cockpitpersonals sein, so die VC. Die Lufthansa wurde wie die gesamte ...",-0.47575,de
Verantwortungsvolles Aluminium: Die Vorteile von Recycling in der ...,https://www.eos.info/de/aktuelles/blog/the-benefits-of-recycling-in-additive-manufacturing,Außerdem hat die Branche ihren Energieverbrauch seit 1998 um 55 % gesenkt. ... Nach Angaben des National Institute of Standards and Technology (NIST) kann die ...,-0.4568,info
News Unternehmen | Pitzek GMP Consulting,https://pitzek-consulting.de/news/,"Die Lounges 2024 war wieder einmal ein Forecast für die neuesten Trends in dieser dynamischen Branche. Mit einem packenden Rahmen-Programm, unzähligen ...",-0.4568,de
