Titel,URL,Beschreibung,Sentiment,Top-Level-Domain
Presse Maritimes Cluster Norddeutschland e.V.,https://www.maritimes-cluster.de/presse/das-maritime-cluster-norddeutschland-ist-mitglied-im-deutschen-maritimen-zentrum/,"Nov 29, 2018 ... ... Deutsche Maritime Zentrum (DMZ) aufgenommen zu sein. Das DMZ agiert als Bindeglied zwischen Wirtschaft, Wissenschaft und öffentlicher Hand ...",0.24695,de
Gründung des Deutschen Maritimen Zentrums - www.vhss.de,https://www.vhbs.de/index.php?id=51&tx_news_pi1%5Bnews%5D=160&tx_news_pi1%5Bcontroller%5D=News&tx_news_pi1%5Baction%5D=detail&cHash=c17e45b11c833a2dbdf34d30541ee82a,"Jul 19, 2017 ... ... maritimen Akteure aus Wirtschaft, Wissenschaft und öffentlicher Hand in Deutschland branchen- und länderübergreifend. Als Think-Tank sollen ...",0.24695,de
Maritimes Cluster Norddeutschland,https://www.hamburg.de/politik-und-verwaltung/behoerden/bwi/themen/maritimes-cluster-199524,Förderung von schiffbaulichen Innovationen deutscher Werften zur Verbesserung der Wettbewerbsfähigkeit der maritimen Wirtschaft in Deutschland. Schließen. Was ...,0.0,de
Offshore-Wind-Strom für einen wettbewerbsfähigen ...,http://www.offshore-stiftung.de/de/13-handlungsempfehlungen-deutschlandweites-wirtschaftswunder-meer,"Mar 5, 2025 ... ... Wettbewerbsfähigkeit und Innovationskraft in Deutschland sein ... maritimen Industrie, der entstehenden Wasserstoffwirtschaft sowie der ...",0.0,de
Finanzierungsinstrumente in der maritimen Branche,https://henry.baw.de/bitstreams/c06f9085-1b77-4b76-8145-d062290a1349/download,"Sep 14, 2021 ... ... deutsche maritime Branche betrachtet ... Wettbewerbsfähigkeit deutscher Reeder und der Sicherung des maritimen Standorts Deutschland, vgl.",0.0,de
Herausforderungen und Chancen durch die Energiewende - IHK ...,https://www.ihk.de/schleswig-holstein/standortpolitik/wirtschaftspolitik/wirtschaftspolitische-positionen/maritime-wirtschaft/positionspapier-13-nationale-maritime-konferenz2-5919172,Die Sicherung der internationalen Wettbewerbsfähigkeit der maritimen Wirtschaft ist eine nationale Aufgabe. Die ... Die maritime Wirtschaft sichert in Deutschland ...,-0.47425,de
Social Media für die Maritime Branche - DMZ | Deutsches Maritimes ...,https://dmz-maritim.de/social-media-fuer-die-maritime-branche/,"Oct 20, 2021 ... ... Wettbewerbsfähigkeit des maritimen Wirtschaftsstandorts Deutschland zu sichern. Dies gilt auch für die maritimen Akteure, die sich mit dem ...",-0.4568,de
Für Organisationen - maritimerpfadfinder,https://maritimerpfadfinder.de/fuer-organisationen,"Das Deutsche Maritime Zentrum e.V. ist eine unabhängige Einrichtung, die die maritime Branche dabei unterstützt, die Wettbewerbsfähigkeit und ...",-0.4568,de
Steuervergünstigung für die Seeschifffahrt durch die ...,https://www.bundesrechnungshof.de/SharedDocs/Downloads/DE/Berichte/2024/tonnagesteuer-volltext.pdf?__blob=publicationFile&v=2,"Jul 23, 2024 ... perspektiven der maritimen Wirtschaft in Deutschland zur Wettbewerbsfähigkeit des Schiff- ... Die deutsche maritime Wirtschaft steht in ...",-0.4568,de
Maritime Wirtschaft - BMWK,https://www.bmwk.de/Redaktion/DE/Dossier/maritime-wirtschaft.html,... Wettbewerbsfähigkeit des Wirtschaftsstandortes und die Sicherung von Wachstum und Beschäftigung. ... Die deutsche maritime Branche ist in vielen Bereichen ...,-0.4158,de
